New RccService version-336605f55f6847b4 at 11/10/2009 3:35:29 PM... Done!
New RccService version-4fb818c8a9004e56 at 11/10/2009 11:32:43 PM... Done!
New Client version-133721681a5245bb at 11/10/2009 11:39:38 PM... Done!
New Client version-a00995fdd72842a2 at 11/11/2009 12:22:26 AM... Done!
New RccService version-0e918a958ffd4782 at 11/18/2009 1:24:07 AM... Done!
New RccService version-ddc196b8bcd249a5 at 11/25/2009 12:54:50 AM... Done!
New Client version-901e02f7d95046c7 at 11/25/2009 1:03:43 AM... Done!
New RccService version-7d5db4f118c04c32 at 12/4/2009 4:16:00 PM... New RccService version-0c5ffd6455e548fd at 12/5/2009 1:17:34 AM... Done!
New RccService version-c2266dad804f4be7 at 12/7/2009 12:57:29 PM... Done!
New RccService version-22f8550585f344fe at 12/11/2009 12:34:35 AM... Done!
New RccService version-80ab88f82c004848 at 12/17/2009 12:34:42 AM... Done!
New Client version-de75ac4e180244b4 at 12/17/2009 12:50:56 AM... Done!
New Client version-a10672c987274c2e at 12/19/2009 12:18:29 AM... Done!
New RccService version-ae2ebf93ac594514 at 1/8/2010 11:31:45 AM... Done!
New RccService version-18f76f9455204d6b at 1/8/2010 12:18:28 PM... Done!
New Client version-29d1896c5e90402b at 1/8/2010 1:16:46 PM... Done!
New RccService version-4716aea87e6b4862 at 1/28/2010 12:10:52 PM... Done!
New Client version-21de5288ed0a4815 at 1/28/2010 12:49:23 PM... Done!
New RccService version-dd563b6774fa465d at 1/29/2010 7:58:17 PM... Done!
New RccService version-0f1f08810c28437b at 2/2/2010 11:57:20 PM... Done!
New Client version-55c9f330859447e9 at 2/3/2010 12:07:18 AM... Done!
New RccService version-417c153f45d04c12 at 2/8/2010 12:06:12 AM... Done!
New Client version-051d6ef9327c43d6 at 2/8/2010 12:18:26 AM... Done!
New RccService version-4cd52e75d3c34d57 at 2/9/2010 10:59:05 AM... Done!
New RccService version-59c05967f3d743e1 at 2/17/2010 9:00:43 AM... Done!
New RccService version-1cc6c9b33b104540 at 2/22/2010 3:06:15 PM... Done!
New RccService version-999834777c564276 at 2/22/2010 4:50:49 PM... Done!
New Client version-999834777c564276 at 2/22/2010 4:58:24 PM... Done!
New RccService version-c0f98c1062154c01 at 2/22/2010 5:34:59 PM... Revert Client version-051d6ef9327c43d6 at 2/22/2010 5:49:53 PM... Done!
Revert RccService version-1cc6c9b33b104540 at 2/22/2010 10:53:53 PM... Done!
New RccService version-8d0138afb42b4263 at 2/24/2010 11:24:20 PM... Done!
New Client version-132090a2c5274767 at 2/24/2010 11:35:51 PM... Done!
New RccService version-efd1729098f04237 at 2/26/2010 1:12:40 PM... Done!
New RccService version-444b649013804201 at 3/4/2010 12:09:43 AM... Done!
New RccService version-68ec7f6deef44c21 at 3/4/2010 5:33:27 PM... Done!
New RccService version-7d7e79612dc54768 at 3/4/2010 6:55:42 PM... Done!
New RccService version-01bcf8614ce84a1c at 3/4/2010 7:09:48 PM... Done!
New RccService version-487af211c7e04397 at 3/5/2010 11:39:42 AM... Done!
New RccService version-ebf3b69dc8da4343 at 3/5/2010 5:19:36 PM... Done!
New RccService version-ad8237b92a694f5a at 3/9/2010 3:53:43 PM... Done!
New RccService version-cc37042eca484bda at 3/9/2010 7:17:11 PM... Done!
New RccService version-c2669ba1bedb4389 at 3/11/2010 1:43:43 PM... Done!
New RccService version-d3a7708666fb4ad1 at 3/11/2010 2:04:35 PM... Done!
New RccService version-d448ecdcbc9d4307 at 3/18/2010 12:02:38 AM... Done!
New Client version-3a86e3c87aac48ab at 3/18/2010 12:14:54 AM... Done!
New Client version-ff6321df121e4477 at 3/18/2010 11:45:54 AM... Done!
New RccService version-285bc17c72d44c6d at 4/3/2010 4:27:26 PM... Done!
Revert RccService version-d448ecdcbc9d4307 at 4/4/2010 3:58:06 AM... Done!
Revert RccService version-d448ecdcbc9d4307 at 4/4/2010 4:00:15 AM... Done!
New RccService version-1c2b300c3e11440c at 4/21/2010 1:40:51 AM... Done!
New Client version-20f6fb29914b403f at 4/21/2010 1:57:31 AM... Done!
New Client version-b8544359c0bb4b49 at 4/21/2010 11:51:42 AM... Done!
Revert RccService version-1c2b300c3e11440c at 4/21/2010 2:32:24 PM... Done!
Revert RccService version-d448ecdcbc9d4307 at 4/21/2010 2:35:22 PM... Done!
Revert Client version-ff6321df121e4477 at 4/21/2010 2:47:51 PM... Done!
New RccService version-775ca2cdec8343c3 at 4/26/2010 1:03:15 AM... Done!
New Client version-bcd6674c9f4642e1 at 4/26/2010 1:27:37 AM... Done!
New RccService version-0a7852e09205488f at 4/29/2010 12:08:50 AM... Done!
New RccService version-cea147d174b549ac at 5/7/2010 4:48:53 AM... Done!
New Client version-acfd835c29bc48bb at 5/7/2010 5:02:08 AM... Done!
New Client version-b5dc796702a14251 at 5/20/2010 12:47:48 AM... Done!
New RccService version-d4d94dd687cf40a3 at 6/10/2010 3:10:57 AM... Done!
New RccService version-e43af721dfb94d12 at 6/17/2010 1:30:36 AM... Done!
New RccService version-87288978be724d88 at 6/17/2010 11:59:33 AM... Done!
New RccService version-4e5e48ed280a49f5 at 6/17/2010 6:44:37 PM... Done!
Revert RccService version-d4d94dd687cf40a3 at 6/17/2010 6:52:27 PM... Done!
New RccService version-ab1dbbea2428467b at 6/18/2010 2:05:49 AM... Done!
New Client version-b954d600dd614662 at 6/18/2010 2:25:55 AM... Done!
New Client version-38688219c12c4bc8 at 6/18/2010 2:26:15 PM... Done!
New RccService version-be4fe84976e1404d at 7/12/2010 12:10:34 AM... Done!
Revert RccService version-ab1dbbea2428467b at 7/12/2010 12:40:02 AM... Done!
Revert RccService version-be4fe84976e1404d at 7/12/2010 10:54:46 AM... Done!
Revert RccService version-ab1dbbea2428467b at 7/12/2010 1:18:20 PM... Done!
New RccService version-f0007e721b414840 at 7/13/2010 12:16:37 AM... Done!
New Client version-2598ca4f86a3480b at 7/13/2010 12:50:15 AM... Done!
New RccService version-dbfa1129411a4a0c at 7/23/2010 12:32:19 AM... Done!
New Client version-ecd6a58467454f8f at 7/23/2010 1:01:56 AM... Done!
New Client version-d2a33ac830d14426 at 7/30/2010 12:34:20 AM... Done!
New Client version-4207b946cf5449f2 at 8/6/2010 7:24:56 PM... Done!
New RccService version-68d64b69a331428f at 8/7/2010 1:02:10 AM... Done!
New Client version-00abda3cb01c4176 at 8/9/2010 1:38:54 PM... Done!
New Client version-b4ca7bb3e4a4467c at 8/13/2010 3:11:28 PM... Done!
New RccService version-14e7174eb967444d at 8/13/2010 4:21:57 PM... Done!
New RccService version-261ff11edf964433 at 8/26/2010 11:26:06 PM... Done!
New Client version-3fbd77a68bfb4dce at 8/26/2010 11:48:21 PM... Done!
New Client version-5721a319bf474443 at 8/27/2010 2:09:02 PM... Done!
New RccService version-04d91f9c3f5048aa at 9/1/2010 7:20:31 PM... Done!
New RccService version-ebdadda1833f4263 at 9/23/2010 12:15:55 AM... Done!
New Client version-a1eb7721bc5a4d87 at 9/23/2010 12:46:10 AM... Done!
Revert RccService version-04d91f9c3f5048aa at 9/23/2010 12:33:46 PM... Done!
Revert Client version-5721a319bf474443 at 9/23/2010 12:47:40 PM... Done!
Revert Client version-5721a319bf474443 at 9/24/2010 4:03:28 PM... Done!
New RccService version-e05b0f2946144627 at 9/28/2010 1:10:10 AM... Done!
New Client version-2b9ab8aa16a646c4 at 9/28/2010 1:24:46 AM... Done!
Revert RccService version-04d91f9c3f5048aa at 9/30/2010 10:08:33 AM... Done!
Revert Client version-5721a319bf474443 at 9/30/2010 10:24:02 AM... Done!
New RccService version-7502ea2f94b3496a at 10/6/2010 2:51:22 PM... Done!
New Client version-df3f881d08604d36 at 10/7/2010 10:20:35 AM... Done!
New RccService version-f938cd1c693f46aa at 10/13/2010 10:25:49 AM... Done!
New Client version-3caf788cd4d847d1 at 10/13/2010 10:38:13 AM... Done!
New RccService version-5cd04d556f7e47b1 at 10/19/2010 12:52:00 PM... Done!
New RccService version-b815a2df922f4d0d at 10/21/2010 10:10:56 AM... Done!
New Client version-dc0c19cfb2a24d67 at 10/21/2010 10:27:24 AM... Done!
New RccService version-17d5d7348161441d at 11/2/2010 12:10:06 AM... Done!
New Client version-6f1ddd54c34d49d4 at 11/2/2010 12:22:00 AM... Done!
New RccService version-aaadf26773ef45d1 at 11/3/2010 10:05:47 AM... Done!
New Client version-f10f49a0d4084c5d at 11/3/2010 10:18:11 AM... Done!
New RccService version-cc7a10d21540461c at 11/8/2010 10:15:21 AM... Done!
New Client version-9c483aa7f90f4781 at 11/8/2010 10:26:55 AM... Done!
New RccService version-f491446133ee45d8 at 11/12/2010 7:48:28 PM... Done!
New RccService version-4ee4211c9134491d at 11/16/2010 4:41:44 PM... Done!
Revert RccService version-cc7a10d21540461c at 11/16/2010 4:56:42 PM... Done!
New RccService version-94ac16a11c0b49b5 at 12/2/2010 10:23:38 AM... Done!
New Client version-f71ba13162994249 at 12/2/2010 10:43:36 AM... Done!
New Client version-ddd9de6fd55e4df2 at 12/2/2010 3:38:50 PM... Done!
New RccService version-101c9c60b5e649fb at 12/15/2010 10:13:21 AM... Done!
New Client version-d7f9ef3b714f4cc5 at 12/15/2010 10:27:40 AM... Done!
New Client version-533d8389a9204515 at 12/15/2010 5:06:58 PM... Done!
New RccService version-bb22eba0c4594f93 at 12/16/2010 1:29:34 AM... Done!
New Client version-da873c9dc6d247fd at 12/17/2010 1:11:01 AM... Done!
New RccService version-fcf833e80bac44e1 at 12/17/2010 1:57:38 AM... Done!
New RccService version-bd4659af810b4fd7 at 1/6/2011 10:32:16 AM, file verion: 0, 30, 1, 10...Done!
New Client version-ef4dd1b2d23141a4 at 1/6/2011 10:49:04 AM, file verion: 0, 30, 1, 10...Done!
New RccService version-d10c79e9d4c740be at 1/6/2011 1:21:00 PM, file verion: 0, 31, 0, 0...New RccService version-a9de9ff0f340401c at 1/6/2011 1:22:55 PM, file verion: 0, 31, 0, 0...Done!
New Client version-88d6725196db4aa9 at 1/6/2011 1:39:48 PM, file verion: 0, 31, 0, 0...Done!
New RccService version-73959213025340f4 at 1/7/2011 3:45:15 PM, file verion: 0, 31, 0, 2...Done!
New RccService version-b5f92f33297b4c6b at 1/27/2011 9:57:28 AM, file verion: 0, 33, 0, 8...Done!
New Client version-4f75e2546079474a at 1/27/2011 10:31:05 AM, file verion: 0, 33, 0, 8...Done!
New Client version-64ca2fbe5a624fd3 at 1/28/2011 2:05:38 AM, file verion: 0, 33, 0, 10...Done!
New RccService version-73167d7170224810 at 1/28/2011 2:37:44 PM, file verion: 0, 33, 0, 10...Done!
New RccService version-f773881671684821 at 2/1/2011 11:45:25 PM, file verion: 0, 33, 1, 0...Done!
New Client version-371a4ef279b14764 at 2/2/2011 12:04:22 AM, file verion: 0, 33, 1, 0...Done!
New RccService version-da7d86d1060148c9 at 2/23/2011 11:53:12 PM, file verion: 0, 34, 0, 22...Done!
New Client version-2de7d827839d40a3 at 2/24/2011 12:24:00 AM, file verion: 0, 34, 0, 22...Done!
New RccService version-491c634cc4a14b9d at 3/8/2011 11:39:55 PM, file verion: 0, 35, 0, 13...Done!
New Client version-e024f7ad93c84253 at 3/8/2011 11:56:34 PM, file verion: 0, 35, 0, 13...Done!
New RccService version-fff95b1424ff49fe at 3/11/2011 1:52:18 PM, file verion: 0, 35, 1, 0...Done!
New Client version-2b18f293e6da4dcc at 3/11/2011 2:20:30 PM, file verion: 0, 35, 1, 0...Done!
New RccService version-6e813bfb33ac418b at 3/27/2011 11:37:47 PM, file verion: 0, 36, 1, 27...Done!
New Client version-a3104dade3dc467f at 3/27/2011 11:55:20 PM, file verion: 0, 36, 1, 27...Done!
Revert RccService version-fff95b1424ff49fe at 3/28/2011 12:17:26 AM... Done!
Revert Client version-2b18f293e6da4dcc at 3/28/2011 12:25:53 AM... Done!
Revert RccService version-6e813bfb33ac418b at 3/28/2011 11:53:19 PM... Done!
Revert Client version-a3104dade3dc467f at 3/29/2011 12:14:12 AM... Done!
New RccService version-978fdda2ac634c5b at 4/6/2011 11:21:51 PM, file verion: 0, 37, 0, 13...Done!
New Client version-f396990c625b4b11 at 4/7/2011 12:52:03 AM, file verion: 0, 37, 0, 13...Done!
New Client version-ffdcbe616f2f4697 at 4/8/2011 12:02:01 AM, file verion: 0, 37, 0, 14...Done!
New RccService version-c8f7acfc993e4051 at 4/20/2011 11:54:19 PM, file verion: 0, 38, 0, 169...Done!
New Client version-20c577f966e441d9 at 4/21/2011 12:17:36 AM, file verion: 0, 38, 0, 169...Done!
New RccService version-213d947bc27c413f at 5/3/2011 11:33:06 PM, file verion: 0, 39, 0, 179...Done!
New Client version-213d947bc27c413f at 5/3/2011 11:34:48 PM, file verion: 0, 39, 0, 179...Done!
New RccService version-fa0afaa31b954bb2 at 5/10/2011 11:20:01 PM, file verion: 0, 39, 0, 187...Done!
New Client version-aee0155547bc45d1 at 5/10/2011 11:40:53 PM, file verion: 0, 39, 0, 187...Done!
New RccService version-d59171cc3da141a8 at 5/13/2011 8:42:34 PM, file verion: 0, 40, 0, 195...Done!
New Client version-d59171cc3da141a8 at 5/13/2011 8:44:18 PM, file verion: 0, 40, 0, 195...Done!
Revert Client version-aee0155547bc45d1 at 5/13/2011 10:41:17 PM... Done!
Revert RccService version-fa0afaa31b954bb2 at 5/13/2011 10:42:20 PM... Done!
New RccService version-cafa00233f014af2 at 5/19/2011 11:39:49 PM, file verion: 0, 40, 0, 202...Done!
New Client version-5fb0645efa584e24 at 5/20/2011 12:05:03 AM, file verion: 0, 40, 0, 202...Done!
New RccService version-0bd676481aef4a01 at 6/13/2011 11:36:46 PM, file verion: 0, 41, 0, 225...Done!
New Client version-fcf5e8633f75410d at 6/14/2011 12:43:34 AM, file verion: 0, 41, 0, 225...Done!
New RccService version-56022e11531046f3 at 6/26/2011 11:53:48 PM, file verion: 0, 42, 0, 238...Done!
New Client version-5ce51d8367464075 at 6/27/2011 12:14:26 AM, file verion: 0, 42, 0, 238...Done!
New RccService version-da96aa7bdd4b401b at 7/20/2011 12:49:51 AM, file verion: 0, 43, 0, 263...Done!
New Client version-f93a5a6aa7924fae at 7/20/2011 1:07:55 AM, file verion: 0, 43, 0, 263...Done!
New RccService version-ff4f861a6b3b47a6 at 7/29/2011 11:37:02 PM, file verion: 0, 43, 1, 264...Done!
New Client version-18c3ec3fed324b69 at 7/30/2011 12:06:15 AM, file verion: 0, 43, 1, 264...Done!
New RccService version-533ae757e2704666 at 8/11/2011 11:43:38 PM, file verion: 0, 44, 0, 291...Done!
New Client version-7a404405e6f944e5 at 8/12/2011 12:21:09 AM, file verion: 0, 44, 0, 291...Done!
New RccService version-5aae26fb33154205 at 8/22/2011 11:35:13 PM, file verion: 0, 44, 1, 296...Done!
New Client version-b0b74ccbad4f4893 at 8/22/2011 11:59:01 PM, file verion: 0, 44, 1, 296...Done!
New RccService version-4d01674a4a2a4a88 at 8/31/2011 11:36:06 PM, file verion: 0, 45, 0, 316...Done!
New Client version-9d8ee47fdc21422e at 8/31/2011 11:54:36 PM, file verion: 0, 45, 0, 316...Done!
New RccService version-52e28e01b88d4aec at 9/1/2011 12:35:12 PM, file verion: 0, 45, 0, 316...Done!
New Client version-52e28e01b88d4aec at 9/1/2011 12:36:21 PM, file verion: 0, 45, 0, 316...Done!
Revert Client version-9d8ee47fdc21422e at 9/1/2011 12:46:33 PM... Done!
Revert RccService version-4d01674a4a2a4a88 at 9/1/2011 12:49:58 PM... Done!
New RccService version-274cdc5e08df4b95 at 9/14/2011 11:47:07 PM, file verion: 0, 45, 0, 324...Done!
New RccService version-be42b4e646694824 at 10/6/2011 11:25:01 PM, file verion: 0, 46, 0, 354...Done!
New Client version-684ac714abb74f38 at 10/6/2011 11:41:46 PM, file verion: 0, 46, 0, 354...Done!
New RccService version-965dee6c13dd4c3e at 10/25/2011 11:17:46 PM, file verion: 0, 47, 0, 380...Done!
New Client version-87de5333d4254860 at 10/25/2011 11:33:20 PM, file verion: 0, 47, 0, 380...Done!
New Client version-55bff205328042f4 at 11/3/2011 12:03:45 AM, file verion: 0, 47, 0, 391...Done!
New RccService version-2c3dfc3b422144df at 11/15/2011 11:34:57 PM, file verion: 0, 48, 0, 416...Done!
New Client version-d18531733302454e at 11/15/2011 11:49:43 PM, file verion: 0, 48, 0, 416...Done!
New Client version-f23119393382428e at 11/16/2011 6:52:53 PM, file verion: 0, 48, 0, 416...Done!
New Client version-fb3436d54f9e4598 at 11/18/2011 12:50:20 AM, file verion: 0, 48, 0, 419...Done!
New RccService version-e15a51a004a74b24 at 12/6/2011 7:32:02 PM, file verion: 0, 48, 1, 421...Done!
New RccService version-34ef76bb9e044e58 at 12/9/2011 12:13:37 AM, file verion: 0, 49, 0, 444...Done!
New Client version-844560f43f354d3f at 12/9/2011 12:29:44 AM, file verion: 0, 49, 0, 444...Done!
New RccService version-17e15e8fac0a4bef at 12/19/2011 12:32:02 AM, file verion: 0, 49, 1, 457...Done!
New Client version-7abe764230c5492d at 12/19/2011 12:45:22 AM, file verion: 0, 49, 1, 457...Done!
New Client version-3929645dd67b46a9 at 12/22/2011 12:32:35 AM, file verion: 0, 49, 1, 464...Done!
New Client version-09a201d8e5f247c7 at 12/23/2011 12:07:36 AM, file verion: 0, 49, 1, 466...Done!
New Client version-7344c3428f1546a4 at 1/9/2012 11:17:17 PM, file verion: 0, 49, 1, 466...Done!
New Client version-7b3d65c79aa445d1 at 1/11/2012 11:29:19 PM, file verion: 0, 49, 1, 477...Done!
New RccService version-c8c1859f811542bd at 1/30/2012 11:30:41 PM, file verion: 0, 50, 0, 502...Done!
New Client version-33cdd1a534aa4a98 at 1/30/2012 11:45:54 PM, file verion: 0, 50, 0, 502...Done!
Revert RccService version-17e15e8fac0a4bef at 1/31/2012 11:12:00 PM... Done!
New RccService version-c66c3163348d4125 at 1/31/2012 11:23:07 PM, file verion: 0, 50, 0, 502...Done!
Revert RccService version-17e15e8fac0a4bef at 1/31/2012 11:24:52 PM... Done!
Revert Client version-7b3d65c79aa445d1 at 1/31/2012 11:38:51 PM... Done!
New RccService version-9a1d6a4264234cbe at 2/1/2012 11:39:04 PM, file verion: 0, 50, 0, 505...Done!
New Client version-87d7b36a1a2e43ec at 2/1/2012 11:51:17 PM, file verion: 0, 50, 0, 505...Done!
New RccService version-423fdd09f8dc4db2 at 2/16/2012 11:36:05 PM, file verion: 0, 51, 0, 521...Done!
New Client version-b3dc906c765c40b6 at 2/16/2012 11:49:58 PM, file verion: 0, 51, 0, 521...Done!
New Client version-21cdb2fff9fb4df2 at 2/22/2012 11:55:09 PM, file verion: 0, 51, 0, 523...Done!
New RccService version-b3e992d7c5fb4800 at 3/8/2012 11:28:03 PM, file verion: 0, 52, 0, 533...Done!
New Client version-59ef45ad660c45f5 at 3/8/2012 11:51:34 PM, file verion: 0, 52, 0, 533...Done!
New RccService version-c926b3f96c2642a2 at 3/22/2012 11:32:58 PM, file verion: 0, 53, 0, 540...Done!
New RccService version-25216c9f32e14b15 at 3/23/2012 12:01:14 AM, file verion: 0, 53, 0, 540...Done!
New RccService version-d846f795e2444a94 at 3/23/2012 12:05:16 AM, file verion: 0, 53, 0, 540...Done!
New Client version-ef80cfd9c83546fe at 3/23/2012 12:19:17 AM, file verion: 0, 53, 0, 540...Done!
New RccService version-7adca1f1a4ef436e at 3/28/2012 11:37:50 PM, file verion: 0, 54, 0, 543...Done!
New Client version-fa4cea1530284e83 at 3/28/2012 11:53:37 PM, file verion: 0, 54, 0, 543...Done!
New RccService version-ce05b3bb25374c31 at 4/4/2012 11:52:41 PM, file verion: 0, 55, 0, 549...Done!
New Client version-ad555162e16d43e0 at 4/5/2012 12:10:20 AM, file verion: 0, 55, 0, 549...Done!
New RccService version-9b73af4e39ee42ef at 4/11/2012 11:49:43 PM, file verion: 0, 56, 0, 554...Done!
New Client version-a35f18a844bd4707 at 4/12/2012 12:05:23 AM, file verion: 0, 56, 0, 554...Done!
New RccService version-9b0efb7f98444a30 at 4/18/2012 11:39:43 PM, file verion: 0, 57, 0, 558...Done!
New Client version-3bc3e39888854c74 at 4/18/2012 11:53:56 PM, file verion: 0, 57, 0, 558...Done!
New RccService version-2b267dfb76874f82 at 4/25/2012 11:46:11 PM, file verion: 0, 58, 0, 560...Done!
New Client version-d2e4e6e567c64738 at 4/26/2012 12:03:26 AM, file verion: 0, 58, 0, 560...Done!
New RccService version-48142ae415d740ed at 5/4/2012 2:26:48 AM, file verion: 0, 59, 0, 567...Done!
New Client version-d8a5144abfd24923 at 5/4/2012 2:39:04 AM, file verion: 0, 59, 0, 567...Done!
Revert RccService version-2b267dfb76874f82 at 5/4/2012 1:56:17 PM... Done!
Revert Client version-d2e4e6e567c64738 at 5/4/2012 2:12:02 PM... Done!
New RccService version-50094bf2473346bb at 5/6/2012 1:25:51 AM, file verion: 0, 59, 0, 569...Done!
New Client version-76ed5b3c6cb0467f at 5/6/2012 1:42:13 AM, file verion: 0, 59, 0, 569...Done!
New RccService version-c321c993c24a4add at 5/16/2012 11:54:26 PM, file verion: 0, 60, 0, 576...Done!
New Client version-7cacfdcf8d724c45 at 5/17/2012 12:07:26 AM, file verion: 0, 60, 0, 576...Done!
New RccService version-9d6ad53265a7476f at 5/24/2012 12:20:57 AM, file verion: 0, 61, 0, 581...Done!
New Client version-221a4807685c44e7 at 5/24/2012 12:34:34 AM, file verion: 0, 61, 0, 581...Done!
New RccService version-52f59147c06143dd at 6/1/2012 12:24:52 AM, file verion: 0, 62, 0, 584...Done!
New Client version-eecd9135a67340ab at 6/1/2012 12:40:53 AM, file verion: 0, 62, 0, 584...Done!
New RccService version-e393b6ce69694904 at 6/14/2012 12:36:30 AM, file verion: 0, 63, 0, 591...Done!
New Client version-e029025a3614426d at 6/14/2012 12:51:55 AM, file verion: 0, 63, 0, 591...Done!
New RccService version-5e3040231e284dcd at 6/21/2012 12:47:28 AM, file verion: 0, 64, 0, 594...Done!
New Client version-6ca07d14e2274822 at 6/21/2012 1:02:30 AM, file verion: 0, 64, 0, 594...Done!
New RccService version-5afb971a34d74934 at 6/28/2012 1:36:33 AM, file version: 0, 65, 0, 596...Done!
New Client version-c25de535ba3642cf at 6/28/2012 1:38:11 AM, file version: 0, 65, 0, 596...Done!
Revert RccService version-5e3040231e284dcd at 6/28/2012 2:05:14 AM... Done!
New RccService version-e6c1f7d7f73f408d at 6/29/2012 12:16:01 AM, file version: 0, 65, 0, 596...Done!
New Client version-0d55b9ea03b547e9 at 6/29/2012 12:18:48 AM, file version: 0, 65, 0, 596...Done!
New RccService version-7c43ae850b1a4878 at 6/29/2012 12:53:13 AM, file version: 0, 65, 0, 596...Done!
New Client version-1932c3fc688b41f3 at 6/29/2012 12:56:11 AM, file version: 0, 65, 0, 596...Done!
Reverting windows-mfc-player-and-studio to version version-1932c3fc688b41f3 at 6/29/2012 1:19:01 AM... Error!
New Client version-3f2bb30af20140a4 at 6/29/2012 1:21:19 AM, file version: 0, 65, 0, 596...Done!
New RccService version-20773621b40a4c48 at 7/3/2012 12:14:20 AM, file version: 0, 65, 0, 598...Done!
New RccService version-f8c403405c4340ae at 7/10/2012 12:27:19 AM, file version: 0, 66, 0, 601...Done!
New Client version-037c042a4c1b49fd at 7/10/2012 12:30:25 AM, file version: 0, 66, 0, 601...Done!
New MFCStudio version-41a5f58abd4941a2 at 7/23/2012 6:59:53 AM, file version: 0, 67, 0, 614...Done!
New Client version-38293b7e060d4866 at 7/23/2012 7:07:02 AM, file version: 0, 67, 0, 614...Done!
New RccService version-416b7c59ae36412e at 7/23/2012 7:13:56 AM, file version: 0, 67, 0, 614...Done!
New Studio version-614741b3a1844d17 at 7/23/2012 7:20:28 AM, file version: 0, 67, 0, 614...Done!
Revert RccService version-f8c403405c4340ae at 7/23/2012 9:24:31 AM...Done!
Revert Client version-037c042a4c1b49fd at 7/23/2012 9:42:17 AM...Done!
New MFCStudio version-f2062236d83f4317 at 7/25/2012 11:11:39 PM, file version: 0, 67, 0, 618...Done!
New Client version-b17c75021d984b56 at 7/25/2012 11:17:53 PM, file version: 0, 67, 0, 618...Done!
New RccService version-224ae8998db84d80 at 7/25/2012 11:26:17 PM, file version: 0, 67, 0, 618...Done!
New Studio version-106d36d5397b4446 at 7/25/2012 11:31:18 PM, file version: 0, 67, 0, 618...Done!
New Studio version-ee06130e2e3c4b28 at 7/26/2012 12:24:49 AM, file version: 0, 67, 0, 618...Done!
New MFCStudio version-56f6a849301640d6 at 7/26/2012 11:21:45 PM, file version: 0, 67, 0, 621...Done!
New Client version-16f9ef27cfcc4bad at 7/26/2012 11:26:33 PM, file version: 0, 67, 0, 621...Done!
New RccService version-01c95f57ef504d9e at 8/3/2012 12:04:22 AM, file version: 0, 67, 1, 624...Done!
New Client version-1031096e0eaf488a at 8/3/2012 11:54:16 PM, file version: 0, 69, 1, 9...Done!
New RccService version-4bab1493fd724e90 at 8/4/2012 12:00:41 AM, file version: 0, 69, 1, 9...Done!
New Client version-1bebb2d1460c4423 at 8/9/2012 12:06:39 AM, file version: 0, 67, 2, 628...Done!
New RccService version-1fc8aa3f1a5e4585 at 8/9/2012 12:17:15 AM, file version: 0, 67, 2, 628...Done!
New MFCStudio version-b23094083e6c452d at 8/15/2012 11:57:28 PM, file version: 0, 68, 0, 639...Done!
New Client version-24713e1f9eb84bed at 8/16/2012 12:00:52 AM, file version: 0, 68, 0, 639...Done!
New Studio version-da60145211364018 at 8/16/2012 12:05:35 AM, file version: 0, 68, 0, 639...Done!
New RccService version-b322098107a242c2 at 8/16/2012 12:11:42 AM, file version: 0, 68, 0, 639...Done!
New Studio version-c7fad004599444e2 at 8/16/2012 1:00:38 AM, file version: 0, 68, 0, 639...Done!
New MFCStudio version-9876e96fd18b45c3 at 8/16/2012 11:51:27 PM, file version: 0, 68, 0, 640...Done!
New Client version-88f213c9d8fd49a1 at 8/16/2012 11:55:23 PM, file version: 0, 68, 0, 640...Done!
New Studio version-21800a285203496f at 8/17/2012 12:01:23 AM, file version: 0, 68, 0, 640...Done!
New RccService version-448b5117b9844d9f at 8/17/2012 12:10:36 AM, file version: 0, 68, 0, 640...Done!
New MFCStudio version-2acc780cc974417a at 8/23/2012 11:52:44 PM, file version: 0, 69, 0, 646...Done!
New Client version-c1e3ff7c94e44086 at 8/23/2012 11:56:16 PM, file version: 0, 69, 0, 646...Done!
New Studio version-759279bde5324199 at 8/24/2012 12:04:30 AM, file version: 0, 69, 0, 646...Done!
New RccService version-ebf080c560624b92 at 8/24/2012 12:12:35 AM, file version: 0, 69, 0, 646...Done!
New MFCStudio version-0b5cde56870f4b56 at 8/28/2012 11:32:40 PM, file version: 0, 70, 0, 651...Done!
New Client version-14148f7d00f24d47 at 8/28/2012 11:33:47 PM, file version: 0, 70, 0, 651...Done!
New Studio version-d1470878c35046fa at 8/28/2012 11:34:52 PM, file version: 0, 70, 0, 651...Done!
New RccService version-6ca8d7fd17c6445b at 8/28/2012 11:38:49 PM, file version: 0, 70, 0, 651...Done!

New MFCStudio version-82274bed5d1647a5 at 9/6/2012 11:55:20 PM, file version: 0, 71, 0, 665...Done!

New Studio version-e0cf500f199a4252 at 9/6/2012 11:56:20 PM, file version: 0, 71, 0, 665...Done!

New Client version-12cd4783f01a48cf at 9/7/2012 12:00:18 AM, file version: 0, 71, 0, 665...Done!

New RccService version-15837aac15324ec1 at 9/7/2012 12:04:58 AM, file version: 0, 71, 0, 665...Done!

New MFCStudio version-feef8250b3404cd7 at 9/8/2012 12:15:34 AM, file version: 0, 71, 0, 669...Done!

New Studio version-04eae82cee2a469e at 9/8/2012 12:17:00 AM, file version: 0, 71, 0, 669...Done!

New Client version-037f5f7c526a4990 at 9/8/2012 12:20:02 AM, file version: 0, 71, 0, 669...Done!

New MFCStudio version-090cd14a09574546 at 9/12/2012 11:59:39 PM, file version: 0, 72, 0, 676...Done!

New Studio version-08d8164925014a95 at 9/13/2012 12:03:41 AM, file version: 0, 72, 0, 676...Done!

New Client version-989516ec0fda489e at 9/13/2012 12:06:45 AM, file version: 0, 72, 0, 676...Done!

New RccService version-a9114a58befd4eb4 at 9/13/2012 12:13:02 AM, file version: 0, 72, 0, 676...Done!

New MFCStudio version-5e7e0a6a8ec542e3 at 9/20/2012 11:56:03 PM, file version: 0, 73, 0, 683...Done!

New Studio version-1ce30b5519594eba at 9/20/2012 11:56:46 PM, file version: 0, 73, 0, 683...Done!

New Client version-5e3e8a498c5b4d63 at 9/21/2012 12:01:14 AM, file version: 0, 73, 0, 683...Done!

New RccService version-beec711ee9cf4882 at 9/21/2012 12:03:09 AM, file version: 0, 73, 0, 683...Done!

New MFCStudio version-91070e32678b4aa2 at 9/27/2012 11:52:59 PM, file version: 0, 74, 0, 688...Done!

New Studio version-9d093cc61aaa48c1 at 9/27/2012 11:55:20 PM, file version: 0, 74, 0, 688...Done!

New Client version-470c28140c5148c2 at 9/27/2012 11:58:47 PM, file version: 0, 74, 0, 688...Done!

New RccService version-072b2f56fd6d4fad at 9/28/2012 12:02:05 AM, file version: 0, 74, 0, 688...Done!

New MFCStudio version-a9c88d7c05e748a9 at 10/3/2012 11:57:16 PM, file version: 0, 75, 0, 691...Done!

New Studio version-1e19b711c086475d at 10/3/2012 11:59:36 PM, file version: 0, 75, 0, 691...Done!

New Client version-b663b0c623664682 at 10/4/2012 12:03:25 AM, file version: 0, 75, 0, 691...Done!

New RccService version-783a06b8c36f46d2 at 10/4/2012 12:05:12 AM, file version: 0, 75, 0, 691...Done!

New MFCStudio version-fe626cbe0de54e94 at 10/6/2012 1:44:18 AM, file version: 0, 76, 0, 694...Done!

New Studio version-8be44d44d933468a at 10/6/2012 1:48:22 AM, file version: 0, 76, 0, 694...Done!

New Client version-846fbff471af4207 at 10/6/2012 1:51:18 AM, file version: 0, 76, 0, 694...Done!

New RccService version-391fa7a3dd544e27 at 10/6/2012 1:53:33 AM, file version: 0, 76, 0, 694...Done!

New MFCStudio version-80308d171ab44074 at 10/11/2012 12:00:13 AM, file version: 0, 76, 0, 695...Done!

New Studio version-3c402b261f614e7c at 10/11/2012 12:02:57 AM, file version: 0, 76, 0, 695...Done!

New Client version-92268008d775409f at 10/11/2012 12:08:50 AM, file version: 0, 76, 0, 695...Done!

New RccService version-8a372f8830754176 at 10/11/2012 12:11:32 AM, file version: 0, 76, 0, 695...Done!

New MFCStudio version-ff2114cc83254faa at 10/18/2012 12:23:29 AM, file version: 0, 77, 0, 696...Done!

New Studio version-9e89f1e3e2004a2c at 10/18/2012 12:24:36 AM, file version: 0, 77, 0, 696...Done!

New Client version-e2ae3203084e490b at 10/18/2012 12:27:43 AM, file version: 0, 77, 0, 696...Done!

New RccService version-c51b53f057ad49a3 at 10/18/2012 12:29:32 AM, file version: 0, 77, 0, 696...Done!

New MFCStudio version-34d5a10fad6241fb at 10/24/2012 11:58:05 PM, file version: 0, 78, 0, 701...Done!

New Studio version-e252b9a7b4774b3e at 10/24/2012 11:59:27 PM, file version: 0, 78, 0, 701...Done!

New Client version-9a11ba172314428c at 10/25/2012 12:02:23 AM, file version: 0, 78, 0, 701...Done!

New RccService version-e8721efd91ff465d at 10/25/2012 12:04:01 AM, file version: 0, 78, 0, 701...Done!

New MFCStudio version-649b8d9ee5494ae3 at 10/26/2012 12:04:00 AM, file version: 0, 78, 1, 702...Done!

New Studio version-8fb18b3b0dc44ad5 at 10/26/2012 12:04:51 AM, file version: 0, 78, 1, 702...Done!

New Client version-322083e762564446 at 10/26/2012 12:07:55 AM, file version: 0, 78, 1, 702...Done!

New RccService version-3c40eb1e75004701 at 10/26/2012 12:11:49 AM, file version: 0, 78, 1, 702...Done!

New MFCStudio version-f79fe321a5a74f62 at 11/8/2012 12:04:50 AM, file version: 0, 79, 0, 708...Done!

New Studio version-543cb30a4e644ae6 at 11/8/2012 12:07:30 AM, file version: 0, 79, 0, 708...Done!

New Client version-78c05653f7414923 at 11/8/2012 12:12:46 AM, file version: 0, 79, 0, 708...Done!

New RccService version-080e4d21ee7e4b5a at 11/8/2012 12:16:05 AM, file version: 0, 79, 0, 708...Done!

New MFCStudio version-b955701ea0494cdd at 11/8/2012 11:58:44 PM, file version: 0, 78, 1, 702...Done!

New Studio version-385b401ee7ab4cda at 11/9/2012 12:00:21 AM, file version: 0, 78, 1, 702...Done!

New Client version-cbdc8c4c0dd24338 at 11/9/2012 12:03:23 AM, file version: 0, 78, 1, 702...Done!

New RccService version-ff75d15420564fc7 at 11/9/2012 12:06:05 AM, file version: 0, 78, 1, 702...Done!

New MFCStudio version-b13468bb2fe24d7a at 11/14/2012 12:02:13 AM, file version: 0, 79, 0, 712...Done!

New Studio version-dae27a273ec947e2 at 11/14/2012 12:04:11 AM, file version: 0, 79, 0, 712...Done!

New Client version-9cc70ab624734f4d at 11/14/2012 12:07:23 AM, file version: 0, 79, 0, 712...Done!

New RccService version-5130b64d84744274 at 11/14/2012 12:10:49 AM, file version: 0, 79, 0, 712...Done!

New MFCStudio version-88f2c6470e52475a at 11/16/2012 12:22:52 AM, file version: 0, 79, 0, 713...Done!

New Studio version-00a6425de2f24ca3 at 11/16/2012 12:23:50 AM, file version: 0, 79, 0, 713...Done!

New Client version-3ebe0cca16b6421c at 11/16/2012 12:27:18 AM, file version: 0, 79, 0, 713...Done!

New RccService version-6d23d3b1d64d4bf3 at 11/16/2012 12:30:14 AM, file version: 0, 79, 0, 713...Done!

New MFCStudio version-574f8d834293455b at 12/2/2012 11:54:50 PM, file version: 0, 80, 0, 733...Done!

New Studio version-d2a0acab9b514e98 at 12/2/2012 11:57:28 PM, file version: 0, 80, 0, 733...Done!

New Client version-3203d0987c7b43bf at 12/3/2012 12:00:27 AM, file version: 0, 80, 0, 733...Done!

New RccService version-af0b68e9ae9847a6 at 12/3/2012 12:05:06 AM, file version: 0, 80, 0, 733...Done!

New MFCStudio version-e973571a29bb4c90 at 12/3/2012 12:15:18 AM, file version: 0, 80, 0, 733...Done!

New Studio version-0a94d03493574a05 at 12/3/2012 12:16:03 AM, file version: 0, 80, 0, 733...Done!

New Client version-28081105cacd492c at 12/3/2012 12:21:17 AM, file version: 0, 80, 0, 733...Done!

New MFCStudio version-4c10bf8f285c4af7 at 12/3/2012 1:02:57 AM, file version: 0, 80, 0, 733...Done!

New Studio version-94938b36007040f0 at 12/3/2012 1:04:40 AM, file version: 0, 80, 0, 733...Done!

New Client version-9662da8152384043 at 12/3/2012 1:07:55 AM, file version: 0, 80, 0, 733...Done!

New RccService version-f660e2ffe51a428c at 12/3/2012 1:09:35 AM, file version: 0, 80, 0, 733...Done!

New MFCStudio version-39bc5390081f47c9 at 12/3/2012 1:48:20 AM, file version: 0, 80, 0, 733...Done!

New Studio version-3bd366a8ac0d43af at 12/3/2012 1:49:22 AM, file version: 0, 80, 0, 733...Done!

New Client version-b65eb6d6d1584d3e at 12/3/2012 1:52:48 AM, file version: 0, 80, 0, 733...Done!

New RccService version-8e8847176a0648e9 at 12/3/2012 1:55:14 AM, file version: 0, 80, 0, 733...Done!

New MFCStudio version-7a34806ec4784bbe at 12/3/2012 3:26:25 AM, file version: 0, 79, 0, 713...Done!

New Studio version-3b3bc5251cf64f26 at 12/3/2012 3:27:11 AM, file version: 0, 79, 0, 713...Done!

New Client version-314fd073d6d74dcc at 12/3/2012 3:34:03 AM, file version: 0, 79, 0, 713...Done!

New RccService version-aec1f76df2b34c79 at 12/3/2012 3:37:22 AM, file version: 0, 79, 0, 713...Done!

New MFCStudio version-d37df74e9d6d46a2 at 12/3/2012 11:57:04 PM, file version: 0, 80, 0, 734...Done!

New Studio version-3938941dc82e448b at 12/3/2012 11:59:01 PM, file version: 0, 80, 0, 734...Done!

New Client version-0bc65639e8654eda at 12/4/2012 12:03:37 AM, file version: 0, 80, 0, 734...Done!

New RccService version-12746a69f0b24aac at 12/4/2012 12:06:57 AM, file version: 0, 80, 0, 734...Done!

New MFCStudio version-012732894899482c at 12/7/2012 1:02:46 AM, file version: 0, 81, 0, 738...Done!

New Studio version-83806af64ca2499f at 12/7/2012 1:04:11 AM, file version: 0, 81, 0, 738...Done!

New Client version-7f608c9e01fb44d4 at 12/7/2012 1:07:15 AM, file version: 0, 81, 0, 738...Done!

New RccService version-30715dec05374bfe at 12/7/2012 1:11:14 AM, file version: 0, 81, 0, 738...Done!

New Studio version-983ee96029c84b8d at 12/11/2012 12:58:48 PM, file version: 2012, 12, 7, 3...Done!

New Client version-5acc042b77fe4879 at 12/13/2012 12:02:21 AM, file version: 0, 82, 0, 740...Done!

New RccService version-e913c7bb82664cbe at 12/13/2012 12:07:46 AM, file version: 0, 82, 0, 740...Done!

New Studio version-e2a5c1f587934fd2 at 12/13/2012 1:03:28 AM, file version: 2012, 12, 7, 3...Done!

New Client version-fbaf58bbbe84491d at 12/20/2012 12:01:37 AM, file version: 0, 83, 0, 754...Done!

New RccService version-3cb48652a4e84a4b at 12/20/2012 12:03:44 AM, file version: 0, 83, 0, 754...Done!

New Studio version-1e53ebdcd11741fa at 12/20/2012 12:28:20 AM, file version: 2012, 12, 14, 1...Done!

New Client version-5e6923568ada47d7 at 1/3/2013 11:59:53 PM, file version: 0, 84, 0, 27882...Done!

New RccService version-1b937c6f94a842f5 at 1/4/2013 12:07:53 AM, file version: 0, 84, 0, 27882...Done!

New Studio version-50f51a7d900941e0 at 1/7/2013 12:33:43 PM, file version: 2013, 1, 4, 8...Done!

Revert Studio version-1e53ebdcd11741fa at 1/7/2013 4:15:29 PM...Done!

New Studio version-192755e3d25142ec at 1/8/2013 12:04:35 PM, file version: 2013, 1, 7, 5...Done!

New Studio version-7c9b49882a914c48 at 1/9/2013 11:06:55 AM, file version: 2013, 1, 8, 2...Done!

New Client version-6e655c3defe448aa at 1/10/2013 12:04:58 AM, file version: 0, 85, 0, 28075...Done!

New RccService version-9a2c54b0bdd44b9b at 1/10/2013 12:07:00 AM, file version: 0, 85, 0, 28075...Done!

New Studio version-7e387243b41f4b4b at 1/10/2013 11:28:42 AM, file version: 2013, 1, 9, 4...Done!

New Studio version-8417dc95acad4506 at 1/14/2013 11:56:58 AM, file version: 2013, 1, 11, 1...Done!
Error!

New Studio version-1d75ac1c6915479c at 1/14/2013 12:01:01 PM, file version: 2013, 1, 11, 1...Done!

New Studio version-83e0ee1c8ce54ed7 at 1/16/2013 11:52:39 AM, file version: 2013, 1, 15, 3...Done!

New Client version-8348ae4a82a047e4 at 1/17/2013 12:08:48 AM, file version: 0, 86, 0, 28496...Done!

New Client version-58bb25d673384171 at 1/17/2013 12:11:08 AM, file version: 0, 86, 0, 28496...Done!

New RccService version-427b01d544e2477e at 1/17/2013 12:15:39 AM, file version: 0, 86, 0, 28496...Done!

New Studio version-bff7a07361c84c3c at 1/17/2013 11:20:10 AM, file version: 2013, 1, 16, 4...Done!

New Studio version-cd0c7218e0444578 at 1/22/2013 1:02:25 PM, file version: 2013, 1, 18, 2...Done!

New Client version-e958465917da4f8b at 1/24/2013 12:04:50 AM, file version: 0, 87, 0, 28843...Done!

New Client version-6b38b73dbca945f9 at 1/24/2013 12:08:06 AM, file version: 0, 87, 0, 28843...Done!

New RccService version-1f4192ea4b4e41c3 at 1/24/2013 12:09:45 AM, file version: 0, 87, 0, 28843...Done!

New Client version-fa136e0eb25549c2 at 1/24/2013 12:16:39 AM, file version: 0, 87, 0, 28843...Done!

New Client version-b646a9003f1e4f36 at 1/24/2013 12:17:31 AM, file version: 0, 87, 0, 28843...Done!

New RccService version-320e7c4110324a60 at 1/24/2013 12:19:34 AM, file version: 0, 87, 0, 28843...Done!

New Client version-921346aa63314cb3 at 1/26/2013 12:30:47 AM, file version: 0, 88, 0, 29066...Done!

New Client version-25fee90509674ec1 at 1/26/2013 12:33:24 AM, file version: 0, 88, 0, 29066...Done!

New RccService version-072911d2683b42d6 at 1/26/2013 12:34:58 AM, file version: 0, 88, 0, 29066...Done!

New Studio version-7269a2335acd4ac2 at 1/28/2013 11:28:03 AM, file version: 2013, 1, 21, 2...Done!

New Studio version-c48420a7044b4e11 at 1/30/2013 2:15:09 PM, file version: 2013, 1, 25, 5...Done!

Revert Studio version-7269a2335acd4ac2 at 1/30/2013 4:09:43 PM...Done!

New Studio version-bb353faa1adc4ef4 at 1/30/2013 10:21:53 PM, file version: 2013, 1, 25, 8...Done!

New Client version-328b9416165542f3 at 1/31/2013 11:30:49 PM, file version: 0, 89, 0, 29394...Done!

New Client version-fb7be8ab4bbb4352 at 1/31/2013 11:31:41 PM, file version: 0, 89, 0, 29394...Done!

New RccService version-ce77da262145497a at 1/31/2013 11:34:14 PM, file version: 0, 89, 0, 29394...Done!

New Studio version-793101aa3d6147af at 1/31/2013 11:52:24 PM, file version: 2013, 1, 30, 4...Done!

New Studio version-2cf98c526ede4058 at 2/4/2013 8:35:28 PM, file version: 2013, 2, 4, 2...Done!

New Studio version-a876b40ff0324f70 at 2/6/2013 12:08:33 PM, file version: 2013, 2, 5, 9...Done!

New Studio version-54853a0336774f68 at 2/6/2013 4:18:29 PM, file version: 2013, 2, 6, 2...Done!

New Studio version-6c5e4f2a9132448c at 2/7/2013 9:26:56 PM, file version: 2013, 2, 7, 3...Done!

New Client version-4923a833367541bb at 2/7/2013 11:59:30 PM, file version: 0, 90, 0, 29610...Done!

New Client version-090353e3882541ce at 2/8/2013 12:00:28 AM, file version: 0, 90, 0, 29610...Done!

New RccService version-bbc6ec66a8b74ac3 at 2/8/2013 12:05:42 AM, file version: 0, 90, 0, 29610...Done!

New Studio version-f6da113eefcb4951 at 2/11/2013 12:09:39 PM, file version: 2013, 2, 8, 5...Done!

New Studio version-8f01aa4ce58947b8 at 2/12/2013 11:16:06 AM, file version: 2013, 2, 11, 5...Done!

New Studio version-9c5e3b3b7b294b32 at 2/13/2013 12:02:15 PM, file version: 2013, 2, 12, 1...Done!

New Client version-673150fb80244383 at 2/14/2013 12:07:23 AM, file version: 0, 91, 0, 29925...Done!

New Client version-e3277e3a07b64440 at 2/14/2013 12:09:37 AM, file version: 0, 91, 0, 29925...Done!

New RccService version-be582c09ffd64de1 at 2/14/2013 12:11:50 AM, file version: 0, 91, 0, 29925...Done!

New Client version-acc00e7404af499b at 2/14/2013 2:46:52 AM, file version: 0, 90, 0, 29610...Done!

New Client version-1c3978d778d144cc at 2/14/2013 2:49:53 AM, file version: 0, 90, 0, 29610...Done!

New RccService version-4b5bf3fde4a14cd9 at 2/14/2013 2:54:29 AM, file version: 0, 90, 0, 29610...Done!

New Client version-170a28a0650f41b6 at 2/14/2013 2:55:39 AM, file version: 0, 90, 0, 29610...Done!

New Client version-d3781d3928ed4815 at 2/14/2013 2:56:29 AM, file version: 0, 90, 0, 29610...Done!

New RccService version-3b12d9f7d56f4c1d at 2/14/2013 2:59:21 AM, file version: 0, 90, 0, 29610...Done!

New RccService version-35869c05b8824852 at 2/14/2013 3:04:44 AM, file version: 0, 90, 0, 29610...Done!

New Client version-3fd4130a2cc844d3 at 2/14/2013 3:14:01 AM, file version: 0, 91, 0, 29925...Done!

New Client version-7d1c681af6ce4329 at 2/14/2013 3:15:54 AM, file version: 0, 91, 0, 29925...Done!

New RccService version-2e0f115ccefd4481 at 2/14/2013 3:17:33 AM, file version: 0, 91, 0, 29925...Done!

New Client version-313a7f98bf6c447f at 2/14/2013 3:18:20 AM, file version: 0, 91, 0, 29925...Done!

New Client version-0cff0a03f2a242ab at 2/14/2013 3:20:38 AM, file version: 0, 91, 0, 29925...Done!

New RccService version-ac277e21d26c455e at 2/14/2013 3:22:26 AM, file version: 0, 91, 0, 29925...Done!

New Client version-ccbc939b6e62491f at 2/14/2013 3:42:50 AM, file version: 0, 91, 0, 29925...Done!

New Client version-9ae7cc04e47a4b12 at 2/14/2013 3:44:21 AM, file version: 0, 91, 0, 29925...Done!

New RccService version-c9b6e63e163c49e3 at 2/14/2013 3:46:43 AM, file version: 0, 91, 0, 29925...Done!

New Studio version-aaa7e35fe2684a57 at 2/15/2013 2:19:06 PM, file version: 2013, 2, 14, 4...Done!

New Studio version-2c25d9c1ffb94664 at 2/20/2013 12:22:44 PM, file version: 2013, 2, 19, 4...Done!

Revert Studio version-aaa7e35fe2684a57 at 2/20/2013 1:51:52 PM...Done!

New Studio version-4b50f23978e44cf9 at 2/21/2013 8:59:15 PM, file version: 2013, 2, 20, 6...Done!

New Client version-878362d883194c59 at 2/21/2013 11:56:43 PM, file version: 0, 92, 0, 30298...Done!

New Client version-3789d377c3ab4ee1 at 2/21/2013 11:58:31 PM, file version: 0, 92, 0, 30298...Done!

New RccService version-c554c69b77d94b12 at 2/22/2013 12:02:11 AM, file version: 0, 92, 0, 30298...Done!

New Studio version-770f45302ad448aa at 2/26/2013 12:47:49 PM, file version: 2013, 2, 25, 2...Done!

New Studio version-1020a6dcce4048d5 at 2/27/2013 11:36:13 AM, file version: 2013, 2, 26, 1...Done!

New Client version-e7f2dcf04ee840da at 2/28/2013 12:02:43 AM, file version: 0, 93, 0, 30595...Done!

New Client version-18d29ad623804580 at 2/28/2013 12:03:28 AM, file version: 0, 93, 0, 30595...Done!

New RccService version-acd3a413c6b646be at 2/28/2013 12:05:47 AM, file version: 0, 93, 0, 30595...Done!

New Studio version-353edb92e5644ed6 at 2/28/2013 2:30:54 PM, file version: 2013, 2, 27, 5...Done!

New Studio version-712b13e21b3b4e12 at 3/6/2013 12:15:18 PM, file version: 2013, 3, 4, 3...Done!

New Client version-fd52c1665fc74a0b at 3/7/2013 12:04:37 AM, file version: 0, 94, 0, 30953...Done!

New Client version-e9bfa9d8c0b14dfb at 3/7/2013 12:05:46 AM, file version: 0, 94, 0, 30953...Done!

New RccService version-a8c41afef96a4041 at 3/7/2013 12:10:16 AM, file version: 0, 94, 0, 30953...Done!

New Studio version-4d66e47111f84458 at 3/7/2013 12:23:49 PM, file version: 2013, 3, 5, 2...Done!

New Studio version-015bdd0ac58c465f at 3/12/2013 3:01:42 PM, file version: 2013, 3, 11, 5...Done!

New Client version-86a4de975cc744e1 at 3/14/2013 12:03:17 AM, file version: 0, 95, 0, 31239...Done!

New Client version-63c0725708364c32 at 3/14/2013 12:04:20 AM, file version: 0, 95, 0, 31239...Done!

New RccService version-41da2832d7ec4207 at 3/14/2013 12:06:24 AM, file version: 0, 95, 0, 31239...Done!

New Client version-03e04c483e54441c at 3/14/2013 12:44:25 AM, file version: 0, 94, 0, 30953...Done!

New Client version-60bd939248ad48f8 at 3/14/2013 12:47:01 AM, file version: 0, 94, 0, 30953...Done!

New RccService version-71c7d6c20a044554 at 3/14/2013 12:50:50 AM, file version: 0, 94, 0, 30953...Done!

New Client version-5634195c8cab49e3 at 3/14/2013 1:07:09 AM, file version: 0, 95, 0, 31239...Done!

New Client version-d27d72c7fa6a4f41 at 3/14/2013 1:07:56 AM, file version: 0, 95, 0, 31239...Done!

New RccService version-b485bceeba4f424a at 3/14/2013 1:10:22 AM, file version: 0, 95, 0, 31239...Done!

New Client version-83b1378112104239 at 3/14/2013 1:20:26 AM, file version: 0, 94, 0, 30953...Done!

New Client version-71787f3edfc64ac4 at 3/14/2013 1:21:39 AM, file version: 0, 94, 0, 30953...Done!

New RccService version-8d198c60429c4bc0 at 3/14/2013 1:24:57 AM, file version: 0, 94, 0, 30953...Done!

New Studio version-19cc5fabc13d400c at 3/14/2013 3:07:46 PM, file version: 2013, 3, 13, 8...Done!

New Client version-f2f3cd1ee12b42ba at 3/14/2013 11:58:41 PM, file version: 0, 95, 0, 31339...Done!

New Client version-ccfce68b6145482d at 3/14/2013 11:59:58 PM, file version: 0, 95, 0, 31339...Done!

New RccService version-8855f53ec4c745f4 at 3/15/2013 12:05:12 AM, file version: 0, 95, 0, 31339...Done!

New Client version-d8b4a4778e9e45f2 at 3/20/2013 12:02:06 AM, file version: 0, 96, 0, 31474...Done!

New Client version-24b96aee74514a6e at 3/20/2013 12:03:21 AM, file version: 0, 96, 0, 31474...Done!

New RccService version-ed78c68808ba48bb at 3/20/2013 12:06:12 AM, file version: 0, 96, 0, 31474...Done!

New Studio version-c42e21507cda4421 at 3/20/2013 12:08:21 PM, file version: 2013, 3, 18, 5...Done!

Revert Studio version-19cc5fabc13d400c at 3/20/2013 2:48:51 PM...Done!

New Client version-ef2356be17c04e43 at 3/21/2013 12:03:32 AM, file version: 0, 96, 0, 31609...Done!

New Client version-8662400b82814a15 at 3/21/2013 12:04:44 AM, file version: 0, 96, 0, 31609...Done!

New RccService version-25bf6a4ac21c4537 at 3/21/2013 12:10:29 AM, file version: 0, 96, 0, 31609...Done!

New Studio version-6bf9f42070594fb4 at 3/21/2013 8:00:50 PM, file version: 2013, 3, 18, 8...Done!

New Studio version-db636f3d29814ce7 at 3/26/2013 2:42:31 PM, file version: 2013, 3, 25, 4...Done!

New Studio version-034067aa6cba42f4 at 3/27/2013 2:24:16 PM, file version: 2013, 3, 25, 6...Done!

New Client version-62dee43afc1f4738 at 3/28/2013 12:05:42 AM, file version: 0, 97, 0, 31857...Done!

New Client version-8da443c5e4f54dd2 at 3/28/2013 12:06:37 AM, file version: 0, 97, 0, 31857...Done!

New RccService version-d8a3c9e9ffb94340 at 3/28/2013 12:08:52 AM, file version: 0, 97, 0, 31857...Done!

New Studio version-17fe54cbcb3c48d4 at 3/28/2013 11:18:21 AM, file version: 2013, 3, 27, 2...Done!

New Client version-3594e6d1333241ff at 3/28/2013 11:59:36 PM, file version: 0, 97, 0, 31912...Done!

New Client version-812f8d4333b24217 at 3/29/2013 12:00:29 AM, file version: 0, 97, 0, 31912...Done!
Error!

New Client version-49d9e432ab2a4182 at 3/29/2013 12:04:48 AM, file version: 0, 97, 0, 31912...Done!

New Client version-98e339da883f4bc2 at 3/29/2013 12:05:41 AM, file version: 0, 97, 0, 31912...Done!

New RccService version-332e04f3dfa845a9 at 3/29/2013 12:07:49 AM, file version: 0, 97, 0, 31912...Done!

New Client version-719688fdb1e94e9a at 4/1/2013 12:00:48 AM, file version: 0, 97, 0, 31945...Done!

New Client version-1812ecf3bde24eeb at 4/1/2013 12:02:12 AM, file version: 0, 97, 0, 31945...Done!

New RccService version-9339f21d46894430 at 4/1/2013 12:06:32 AM, file version: 0, 97, 0, 31945...Done!

New Client version-a45433ed822e4374 at 4/3/2013 11:58:48 PM, file version: 0, 98, 0, 31956...Done!

New Client version-5c703d6176af434b at 4/4/2013 12:00:26 AM, file version: 0, 98, 0, 31956...Done!

New RccService version-711eee0aa23d4e5a at 4/4/2013 12:02:22 AM, file version: 0, 98, 0, 31956...Done!

New Studio version-ebe4c9411e304526 at 4/10/2013 4:13:40 PM, file version: 2013, 4, 10, 8...Done!

New Client version-4dd8f412499c4871 at 4/11/2013 12:02:52 AM, file version: 0, 99, 0, 32143...Done!

New Client version-54257e546c7e4443 at 4/11/2013 12:04:21 AM, file version: 0, 99, 0, 32143...Done!

New RccService version-fa5d56c83bb94aa1 at 4/11/2013 12:08:49 AM, file version: 0, 99, 0, 32143...Done!

New Studio version-5266e3421f9e444e at 4/15/2013 11:50:51 AM, file version: 2013, 4, 14, 1...Done!

Revert Studio version-ebe4c9411e304526 at 4/15/2013 8:17:02 PM...Done!

New Studio version-4a966864d2e84500 at 4/16/2013 4:11:02 PM, file version: 2013, 4, 16, 1...Done!

New Client version-f222b1da0383477f at 4/18/2013 12:09:07 AM, file version: 0, 100, 0, 32485...Done!

New Client version-bb07ab23647d4e8a at 4/18/2013 12:13:16 AM, file version: 0, 100, 0, 32485...Done!

New RccService version-7e5c6b7601f74243 at 4/18/2013 12:17:49 AM, file version: 0, 100, 0, 32485...Done!

New Studio version-706c99e73e4f4bb4 at 4/24/2013 12:47:28 PM, file version: 2013, 4, 23, 1...Done!

New Studio version-ca0d8af360724c66 at 5/1/2013 11:58:21 AM, file version: 2013, 4, 30, 2...Done!

New Client version-98a2db5d22e34279 at 5/2/2013 12:07:22 AM, file version: 0, 101, 0, 33010...Done!

New Client version-12f64e18967d4a22 at 5/2/2013 12:11:44 AM, file version: 0, 101, 0, 33010...Done!

New RccService version-9e7ec68cadcd4d90 at 5/2/2013 12:19:35 AM, file version: 0, 101, 0, 33010...Done!

New Studio version-d698e13bcf164171 at 5/2/2013 12:08:01 PM, file version: 2013, 5, 1, 4...Done!

New Studio version-e6cebf76393e45fc at 5/6/2013 3:54:58 PM, file version: 2013, 5, 3, 2...Done!

New Studio version-df3e68d7108d44d8 at 5/8/2013 12:03:37 PM, file version: 2013, 5, 7, 1...Done!

New Client version-1a23fdbca04d4954 at 5/9/2013 12:05:13 AM, file version: 0, 102, 0, 33568...Done!

New RccService version-eec1ebcfbebc42ae at 5/9/2013 12:11:58 AM, file version: 0, 102, 0, 33568...Done!

New Studio version-8608ff54d8aa484f at 5/9/2013 4:29:05 PM, file version: 2013, 5, 9, 2...Done!

New Client version-2fc7393676ba4619 at 5/15/2013 11:59:44 PM, file version: 0, 103, 0, 33664...Done!

New RccService version-9feef918711a44a9 at 5/16/2013 12:06:49 AM, file version: 0, 103, 0, 33664...Done!

New Studio version-ac1ceec948c84f3d at 5/16/2013 12:48:20 PM, file version: 2013, 5, 15, 2...Done!

Revert Studio version-8608ff54d8aa484f at 5/16/2013 3:16:43 PM...Done!

New Studio version-c3773c5e595a4ac9 at 5/22/2013 1:03:40 PM, file version: 2013, 5, 21, 2...Done!

Revert Studio version-8608ff54d8aa484f at 5/22/2013 3:18:42 PM...Done!

New Client version-1c9e96c90cc34ec4 at 5/23/2013 12:04:47 AM, file version: 0, 104, 0, 33895...Done!

New Client version-0109ad1f6a1e4559 at 5/23/2013 12:08:53 AM, file version: 0, 104, 0, 33895...Done!

New RccService version-50774041afed4c6f at 5/23/2013 12:16:59 AM, file version: 0, 104, 0, 33895...Done!

New Client version-1f5b178842834fcb at 5/23/2013 2:40:12 AM, file version: 0, 103, 0, 33664...Done!

New Client version-9ad79ea7b31f4af2 at 5/23/2013 2:44:10 AM, file version: 0, 103, 0, 33664...Error!

New Client version-3392a7564bc74d03 at 5/23/2013 2:47:13 AM, file version: 0, 103, 0, 33664...Done!

New Client version-7173845137fa49b8 at 5/23/2013 2:51:21 AM, file version: 0, 103, 0, 33664...Done!

New RccService version-0df85d73f136400e at 5/23/2013 2:59:25 AM, file version: 0, 103, 0, 33664...Done!

New Client version-dbda85a2d0d64b49 at 5/23/2013 3:54:31 AM, file version: 0, 104, 0, 33895...Done!

New Client version-83922e29dd93478a at 5/23/2013 3:58:06 AM, file version: 0, 104, 0, 33895...Done!

New RccService version-d019aa48c1064be9 at 5/23/2013 4:06:25 AM, file version: 0, 104, 0, 33895...Done!
Error!

New Client version-584e187c66cf41b4 at 5/23/2013 4:22:01 AM, file version: 0, 104, 0, 33895...Done!

New Client version-1c92e6916e7c4b20 at 5/23/2013 4:26:40 AM, file version: 0, 104, 0, 33895...Done!

New RccService version-dfd7417877fe4cba at 5/23/2013 4:33:51 AM, file version: 0, 104, 0, 33895...Done!

New Studio version-e81bdf8a24e1480d at 5/29/2013 12:02:38 PM, file version: 2013, 5, 23, 2...Done!

Revert Studio version-8608ff54d8aa484f at 5/29/2013 1:48:18 PM...Done!

New Client version-51b536e706b6404d at 5/29/2013 11:51:06 PM, file version: 0, 105, 0, 34261...Done!

New Client version-7c745f9d0c23471b at 5/29/2013 11:52:02 PM, file version: 0, 105, 0, 34261...Done!

New RccService version-18d2c8034611431b at 5/29/2013 11:55:37 PM, file version: 0, 105, 0, 34261...Done!

New Studio version-c9b3088590f54c3d at 6/4/2013 12:44:30 PM, file version: 2013, 5, 31, 1...Done!

New Studio version-0f182bb5f84e46cd at 6/5/2013 3:18:27 PM, file version: 2013, 6, 5, 1...Done!

New Client version-4292c244319d4e0d at 6/5/2013 11:47:19 PM, file version: 0, 106, 0, 34414...Done!

New Client version-1ff4978f36a64477 at 6/5/2013 11:48:15 PM, file version: 0, 106, 0, 34414...Done!

New RccService version-d32f4658953b438c at 6/5/2013 11:50:22 PM, file version: 0, 106, 0, 34414...Done!

New Studio version-b56c901b89d44356 at 6/6/2013 11:44:39 AM, file version: 2013, 6, 5, 3...Done!

New Studio version-3363ce97cfb94ae6 at 6/10/2013 1:58:56 PM, file version: 2013, 6, 9, 1...Done!

New Client version-fa3df15f4840476b at 6/12/2013 11:53:30 PM, file version: 0, 107, 0, 34713...Done!

New Client version-695ea9f5bdba4fec at 6/12/2013 11:54:25 PM, file version: 0, 107, 0, 34713...Done!

New RccService version-81141e7febf9453d at 6/12/2013 11:56:50 PM, file version: 0, 107, 0, 34713...Done!

New Client version-9760f6497be541ad at 6/20/2013 12:07:19 AM, file version: 0, 108, 0, 34788...Done!

New Client version-bac2ef28b67142d0 at 6/20/2013 12:08:17 AM, file version: 0, 108, 0, 34788...Done!

New RccService version-93fc5212fed549f5 at 6/20/2013 12:10:27 AM, file version: 0, 108, 0, 34788...Done!

New Client version-b6fcc95bc14548c6 at 6/28/2013 12:00:00 AM, file version: 0, 109, 0, 35235...Done!

New Client version-dd42e0d1fa6244d2 at 6/28/2013 12:00:52 AM, file version: 0, 109, 0, 35235...Done!

New RccService version-53bb8084e3e846a1 at 6/28/2013 12:03:58 AM, file version: 0, 109, 0, 35235...Done!

New Client version-7b2ab18e0e374b77 at 6/29/2013 1:05:01 AM, file version: 0, 109, 0, 35284...Done!

New Client version-1269914021154919 at 6/29/2013 1:06:02 AM, file version: 0, 109, 0, 35284...Done!

New RccService version-c8ba7e89dda44ed7 at 6/29/2013 1:08:31 AM, file version: 0, 109, 0, 35284...Done!

New Studio version-0491ead2578c4058 at 7/1/2013 12:10:12 PM, file version: 2013, 6, 28, 1...Done!

New Client version-bf8c91b036544204 at 7/1/2013 11:53:01 PM, file version: 0, 110, 0, 35357...Done!

New Client version-6cfc785e896545ae at 7/1/2013 11:54:20 PM, file version: 0, 110, 0, 35357...Done!

New RccService version-bc7d59316e3d4bfc at 7/1/2013 11:56:26 PM, file version: 0, 110, 0, 35357...Done!

New Studio version-594d6625683a4e63 at 7/9/2013 4:23:20 PM, file version: 2013, 7, 9, 1...Done!

New Client version-e7945240bb7b4d72 at 7/11/2013 12:01:06 AM, file version: 0, 111, 0, 35600...Done!

New Client version-7bba248538754234 at 7/11/2013 12:01:48 AM, file version: 0, 111, 0, 35600...Done!

New RccService version-6de09429635841b8 at 7/11/2013 12:04:56 AM, file version: 0, 111, 0, 35600...Done!

New Studio version-b1eb06381c92455a at 7/11/2013 12:06:37 AM, file version: 2013, 7, 10, 1...Done!

Revert Studio version-0491ead2578c4058 at 7/11/2013 12:42:01 AM...Done!

New Studio version-8f55e7e3e12549b8 at 7/11/2013 1:09:11 AM, file version: 2013, 7, 10, 1...Done!

New Studio version-8f23d3f3f45a4f2d at 7/16/2013 11:56:37 AM, file version: 2013, 7, 15, 1...Done!

New Client version-3555a9efac334675 at 7/17/2013 11:50:21 PM, file version: 0, 112, 0, 35870...Done!

New Client version-27973050fb3b494f at 7/17/2013 11:51:15 PM, file version: 0, 112, 0, 35870...Done!

New RccService version-528f7cc141214773 at 7/17/2013 11:53:21 PM, file version: 0, 112, 0, 35870...Done!

New Studio version-0e3362105ce44a00 at 7/22/2013 12:17:46 PM, file version: 2013, 7, 17, 2...Done!

New Client version-e96db44aa3a848f3 at 7/24/2013 11:50:01 PM, file version: 0, 113, 0, 36052...Done!

New Client version-8049d9622c164956 at 7/24/2013 11:52:27 PM, file version: 0, 113, 0, 36052...Done!

New RccService version-d6f26737ddf040bc at 7/24/2013 11:54:52 PM, file version: 0, 113, 0, 36052...Done!

New Studio version-a1d341f31c1a40d7 at 7/29/2013 3:00:03 PM, file version: 2013, 7, 29, 1...Done!

Revert Studio version-0e3362105ce44a00 at 7/29/2013 4:30:19 PM...Done!

New Client version-684c5da2d8ab4528 at 7/31/2013 11:52:51 PM, file version: 0, 114, 0, 36086...Done!

New Client version-c5357fcf5b544474 at 7/31/2013 11:53:39 PM, file version: 0, 114, 0, 36086...Done!

New RccService version-49bb375b27914c6a at 7/31/2013 11:56:26 PM, file version: 0, 114, 0, 36086...Done!

New Studio version-ed8dc54b68ac46f6 at 8/1/2013 12:35:31 PM, file version: 2013, 7, 31, 1...Done!

New Studio version-9d48c4c011fc48e2 at 8/2/2013 11:20:44 AM, file version: 2013, 8, 1, 2...Done!

New Client version-6578e7baa4e743db at 8/6/2013 11:53:16 PM, file version: 0, 115, 0, 36630...Done!

New Client version-5fd8234dbfe247fe at 8/6/2013 11:54:30 PM, file version: 0, 115, 0, 36630...Done!

New RccService version-613bec3dccc647b6 at 8/6/2013 11:56:34 PM, file version: 0, 115, 0, 36630...Done!

New Studio version-e6288f5ea3794f07 at 8/13/2013 11:42:12 AM, file version: 2013, 8, 12, 2...Done!

New Studio version-082707b4063a45b0 at 8/14/2013 12:44:54 PM, file version: 2013, 8, 13, 2...Done!

New Client version-f536ccab84494177 at 8/14/2013 11:45:11 PM, file version: 0, 116, 0, 36677...Done!

New Client version-7a09575a935641a6 at 8/14/2013 11:46:08 PM, file version: 0, 116, 0, 36677...Done!

New RccService version-dcf86a8c27da4d55 at 8/14/2013 11:50:42 PM, file version: 0, 116, 0, 36677...Done!

New Client version-7d79d6c551634f2d at 8/15/2013 2:07:25 AM, file version: 0, 115, 0, 36630...Done!

New Client version-de28ff35e3b94bff at 8/15/2013 2:09:07 AM, file version: 0, 115, 0, 36630...Done!

New RccService version-04c8a571cd194da6 at 8/15/2013 2:11:03 AM, file version: 0, 115, 0, 36630...Done!

New Client version-799e3c60e2c44e0d at 8/15/2013 2:25:34 AM, file version: 0, 116, 0, 36677...Done!

New Client version-6ffb29c6a6974fcb at 8/15/2013 2:26:17 AM, file version: 0, 116, 0, 36677...Done!

New RccService version-20f73785ab0e4652 at 8/15/2013 2:28:38 AM, file version: 0, 116, 0, 36677...Done!

New Client version-aa453c6c34394bd8 at 8/15/2013 2:34:32 AM, file version: 0, 115, 0, 36630...Done!

New Client version-60f3df0d5a16441e at 8/15/2013 2:35:16 AM, file version: 0, 115, 0, 36630...Done!

New RccService version-9f62ee21ac8d417c at 8/15/2013 2:37:44 AM, file version: 0, 115, 0, 36630...Done!

New Client version-66b3e8214790449c at 8/15/2013 11:27:18 PM, file version: 0, 116, 0, 36677...Done!

New Client version-dba29cbbeb3440f1 at 8/15/2013 11:28:08 PM, file version: 0, 116, 0, 36677...Done!

New RccService version-725119a5f0b54373 at 8/15/2013 11:30:29 PM, file version: 0, 116, 0, 36677...Done!

New Client version-84723ab05aa444a1 at 8/16/2013 11:31:42 PM, file version: 0, 116, 0, 37007...Done!

New Client version-7cb7ff22d9334da0 at 8/16/2013 11:32:27 PM, file version: 0, 116, 0, 37007...Done!

New RccService version-1d833061471b4f68 at 8/16/2013 11:34:41 PM, file version: 0, 116, 0, 37007...Done!

New Studio version-e5d78232f11b4242 at 8/20/2013 12:48:19 PM, file version: 2013, 8, 19, 1...Done!

New Studio version-7519fce566d742cb at 8/21/2013 2:01:38 PM, file version: 2013, 8, 21, 1...Done!

New Client version-d7af30dea93344ac at 8/21/2013 11:31:07 PM, file version: 0, 117, 0, 37187...Done!

New Client version-8484f0d4199b4d0f at 8/21/2013 11:32:22 PM, file version: 0, 117, 0, 37187...Done!

New RccService version-b7e7a10b9cd7452b at 8/21/2013 11:34:30 PM, file version: 0, 117, 0, 37187...Done!

New Studio version-d6c90879d8594574 at 8/26/2013 1:08:55 PM, file version: 2013, 8, 22, 2...Done!

Revert Studio version-7519fce566d742cb at 8/26/2013 6:47:52 PM...Done!

New Client version-7f156eab1e764642 at 8/28/2013 11:43:02 PM, file version: 0, 118, 0, 37235...Done!

New Client version-13f0b9202d62409a at 8/28/2013 11:46:43 PM, file version: 0, 118, 0, 37235...Done!

New RccService version-7160801b926c4384 at 8/28/2013 11:48:52 PM, file version: 0, 118, 0, 37235...Done!

New Studio version-48b52933639542ad at 8/30/2013 1:06:39 AM, file version: 2013, 8, 28, 1...Done!

New Studio version-e6677e1e9b184e96 at 9/3/2013 12:42:27 PM, file version: 2013, 9, 2, 1...Done!

New Studio version-05aabadc7fa2450c at 9/4/2013 2:57:23 PM, file version: 2013, 9, 3, 1...Done!

New Client version-bfcf9c6870e347ac at 9/4/2013 11:49:36 PM, file version: 0, 119, 0, 37583...Done!

New Client version-759151294bb84441 at 9/4/2013 11:50:28 PM, file version: 0, 119, 0, 37583...Done!

New RccService version-eaed792add3d429b at 9/4/2013 11:52:56 PM, file version: 0, 119, 0, 37583...Done!

New Studio version-269e42d3e2e14638 at 9/5/2013 1:22:41 PM, file version: 2013, 9, 4, 2...Done!

New RccService version-15398883e21a4a3d at 9/11/2013 11:59:04 PM, file version: 0, 120, 0, 37812...Done!

New WindowsPlayer version-914f6edfe4234b71 at 9/11/2013 11:59:51 PM, file version: 0, 120, 0, 37812...Done!

New Client version-9bd05bcd603043ab at 9/12/2013 1:44:25 AM, file version: 0, 120, 0, 37812...Done!

New Client version-4c41dd730a224c01 at 9/12/2013 1:58:26 AM, file version: 0, 120, 0, 37812...Done!

New Client version-d82a79c3d21b4b67 at 9/12/2013 1:59:18 AM, file version: 0, 120, 0, 37812...Done!

New Studio version-503439f3ad5d4e68 at 9/12/2013 1:44:45 PM, file version: 2013, 9, 12, 1...Done!

New RccService version-1eb1fa581f2f4c55 at 9/18/2013 11:48:08 PM, file version: 0, 121, 0, 37958...Done!

New WindowsPlayer version-19c5d0ac8e9b47c4 at 9/18/2013 11:48:59 PM, file version: 0, 121, 0, 37958...Done!

New Studio version-e8936cd10a7748e5 at 9/19/2013 12:37:00 PM, file version: 2013, 9, 18, 2...Done!

New RccService version-f8886eadd9b64461 at 9/21/2013 12:02:57 AM, file version: 0, 121, 1, 37958...Done!

New WindowsPlayer version-e51d9fbd5a3e49c4 at 9/21/2013 12:03:58 AM, file version: 0, 121, 1, 37958...Done!

New RccService version-e0045553b3b8478a at 9/26/2013 12:07:23 AM, file version: 0, 122, 0, 38287...Done!

New WindowsPlayer version-394f11f19cd64b1a at 9/26/2013 12:08:16 AM, file version: 0, 122, 0, 38287...Done!

New Studio version-df3d5c20e74246da at 9/26/2013 12:53:32 PM, file version: 2013, 9, 26, 2...Done!

New RccService version-dbf3ecc912bb48f2 at 10/1/2013 11:46:47 PM, file version: 0, 123, 0, 38618...Done!

New WindowsPlayer version-14fe283fc52248e5 at 10/1/2013 11:47:51 PM, file version: 0, 123, 0, 38618...Done!

New Studio version-095043a68e9141ca at 10/3/2013 11:51:33 AM, file version: 2013, 10, 2, 2...Done!

New RccService version-233cb3787e844d1f at 10/10/2013 12:04:46 AM, file version: 0, 124, 0, 38869...Done!

New WindowsPlayer version-d7b44391e3ff4217 at 10/10/2013 12:06:09 AM, file version: 0, 124, 0, 38869...Done!

New Studio version-56937b926e9d43e2 at 10/10/2013 9:00:56 PM, file version: 2013, 10, 10, 3...Done!

New RccService version-0f9bf4db4b5440a7 at 10/16/2013 11:39:17 PM, file version: 0, 125, 0, 39134...Done!

New WindowsPlayer version-df24752ec7384d96 at 10/16/2013 11:40:42 PM, file version: 0, 125, 0, 39134...Done!

New Studio version-5b74ffef484b43b0 at 10/17/2013 12:22:01 PM, file version: 2013, 10, 16, 1...Done!

New RccService version-c3948de35ec9433f at 10/23/2013 11:42:14 PM, file version: 0, 126, 0, 39503...Done!

New WindowsPlayer version-22d46fdc522044b7 at 10/23/2013 11:44:13 PM, file version: 0, 126, 0, 39503...Done!

New Studio version-bfa867fc58724b50 at 10/24/2013 11:47:32 AM, file version: 2013, 10, 23, 2...Done!

New RccService version-d80d56fbd8524bdf at 10/30/2013 11:34:54 PM, file version: 0, 127, 0, 39583...Done!

New WindowsPlayer version-97c0e76356f746a6 at 10/30/2013 11:36:33 PM, file version: 0, 127, 0, 39583...Done!

New Studio version-54c293390e974900 at 10/31/2013 11:49:57 AM, file version: 2013, 10, 30, 1...Done!

New Studio version-cbae3f23c8574512 at 11/1/2013 11:31:43 AM, file version: 2013, 10, 31, 1...Done!

New RccService version-2c3d236654ed4dd9 at 11/6/2013 11:43:03 PM, file version: 0, 128, 0, 40233...Done!

New RccService version-19baa2fb339049b9 at 11/6/2013 11:49:39 PM, file version: 0, 128, 0, 40233...Done!

New WindowsPlayer version-e6e28771c8004032 at 11/6/2013 11:51:24 PM, file version: 0, 128, 0, 40233...Done!

New Studio version-461680a6b5b746ff at 11/7/2013 11:38:00 AM, file version: 2013, 11, 6, 2...Done!

New RccService version-5496f4e328194b42 at 11/13/2013 11:41:09 PM, file version: 0, 129, 0, 40334...Done!

New WindowsPlayer version-fd63d8cdc8954fbd at 11/13/2013 11:42:50 PM, file version: 0, 129, 0, 40334...Done!

New Studio version-7538edb6089d461b at 11/14/2013 12:03:14 PM, file version: 2013, 11, 13, 1...Done!

New RccService version-215cb43e04df42d9 at 11/17/2013 12:02:21 AM, file version: 0, 128, 0, 40233...Done!

New WindowsPlayer version-16ab4a22d1b64a68 at 11/17/2013 12:04:11 AM, file version: 0, 128, 0, 40233...Done!

New RccService version-a714658e53324390 at 11/20/2013 11:38:35 PM, file version: 0, 130, 0, 40578...Done!

New WindowsPlayer version-e4be089b108348a6 at 11/20/2013 11:40:07 PM, file version: 0, 130, 0, 40578...Done!

New Studio version-b67469696d874ffb at 11/21/2013 11:53:03 AM, file version: 2013, 11, 20, 1...Done!

Revert Studio version-7538edb6089d461b at 11/21/2013 1:25:16 PM...Done!

New Studio version-b57022a4c4dc47b5 at 11/22/2013 11:39:25 AM, file version: 2013, 11, 21, 2...Done!

New RccService version-bf4b36be85154024 at 11/25/2013 11:30:23 PM, file version: 0, 130, 0, 40915...Done!

New WindowsPlayer version-6c381b4cfd5a4f96 at 11/25/2013 11:32:01 PM, file version: 0, 130, 0, 40915...Done!

New Studio version-37aa5de965994585 at 11/26/2013 11:39:03 AM, file version: 2013, 11, 25, 2...Done!

New RccService version-06db2674c8444196 at 12/4/2013 11:48:21 PM, file version: 0, 131, 0, 41087...Done!

New WindowsPlayer version-bce30591d031432c at 12/4/2013 11:49:58 PM, file version: 0, 131, 0, 41087...Done!

New Studio version-70f7cc0d6e7744f5 at 12/5/2013 1:25:12 PM, file version: 2013, 12, 4, 1...Done!

New RccService version-d3fadbee396d4dda at 12/11/2013 11:36:55 PM, file version: 0, 132, 0, 41338...Done!

New WindowsPlayer version-28a069d7dccb4f92 at 12/11/2013 11:38:32 PM, file version: 0, 132, 0, 41338...Done!

New Studio version-e8589838e11e440e at 12/11/2013 11:48:06 PM, file version: 0, 132, 0, 41338...Done!

New Studio version-32fe7f768a804ece at 12/11/2013 11:57:05 PM, file version: 2013, 12, 4, 1...Done!

New Studio version-d891b6614f9340af at 12/12/2013 12:06:01 AM, file version: 0, 132, 0, 41338...Done!

New Studio version-52917cc9e87842e6 at 12/12/2013 12:46:38 AM, file version: 0, 132, 0, 41338...Done!

Revert Studio version-70f7cc0d6e7744f5 at 12/12/2013 11:54:44 AM...Done!

New Studio version-95d80c003e3a4601 at 12/12/2013 9:00:58 PM, file version: 2013, 12, 12, 5...Done!

New Studio version-54058c7492ae4bee at 1/9/2014 1:01:13 AM, file version: 0, 133, 0, 41832...Done!

New RccService version-1d8bec55e0314587 at 1/9/2014 1:06:04 AM, file version: 0, 133, 0, 41832...Done!

New WindowsPlayer version-e53619f61b8f4141 at 1/9/2014 1:08:24 AM, file version: 0, 133, 0, 41832...Done!

Revert Studio version-95d80c003e3a4601 at 1/9/2014 3:34:29 PM...Done!

New Studio version-2e8286e986f84987 at 1/9/2014 11:39:33 PM, file version: 0, 133, 0, 41991...Done!

New RccService version-6d7f58ac6cbe431b at 1/9/2014 11:44:10 PM, file version: 0, 133, 0, 41991...Done!

New WindowsPlayer version-8031f568a8214a5f at 1/9/2014 11:46:33 PM, file version: 0, 133, 0, 41991...Done!

New Studio version-81101b8858844844 at 1/13/2014 2:43:47 PM, file version: 2014, 1, 10, 1...Done!

New Studio version-62d4f0e741b14ebc at 1/15/2014 11:35:26 PM, file version: 0, 134, 0, 42173...Done!

New RccService version-0e7d150960be453f at 1/15/2014 11:42:40 PM, file version: 0, 134, 0, 42173...Done!

New WindowsPlayer version-de8b84f90efc4ca5 at 1/15/2014 11:45:11 PM, file version: 0, 134, 0, 42173...Done!

New RccService version-81929ab733474273 at 1/20/2014 11:37:20 PM, file version: 0, 134, 1, 42400...Done!

New WindowsPlayer version-4d86019d16fc4ea5 at 1/20/2014 11:38:54 PM, file version: 0, 134, 1, 42400...Done!

New Studio version-ca620d54aff94cbb at 1/22/2014 11:30:44 PM, file version: 0, 135, 0, 42435...Done!

New RccService version-1ef569f11afd4d14 at 1/22/2014 11:37:53 PM, file version: 0, 135, 0, 42435...Done!

New WindowsPlayer version-2c68f7c30e1b4888 at 1/22/2014 11:40:28 PM, file version: 0, 135, 0, 42435...Done!

New Studio version-8641989bb25e43a1 at 2/4/2014 8:44:17 PM, file version: 2014, 2, 4, 1...Done!

New Studio version-f66e7ff5db184b7a at 2/5/2014 11:32:26 PM, file version: 0, 136, 0, 43052...Done!

New RccService version-9e2268a474ca4dc0 at 2/5/2014 11:39:29 PM, file version: 0, 136, 0, 43052...Done!

New WindowsPlayer version-afc74353f06542bd at 2/5/2014 11:41:49 PM, file version: 0, 136, 0, 43052...Done!

New Studio version-9c926aff7c5744fe at 2/12/2014 11:36:01 PM, file version: 0, 137, 0, 43210...Done!

New RccService version-f7f46f0dcbb84dca at 2/12/2014 11:43:16 PM, file version: 0, 137, 0, 43210...Done!

New WindowsPlayer version-256d780acc6049ae at 2/12/2014 11:45:35 PM, file version: 0, 137, 0, 43210...Done!

New Studio version-8cf9c8c38e744652 at 2/13/2014 6:41:59 PM, file version: 2014, 2, 13, 2...Done!

New Studio version-ca646dc4e92541f8 at 2/19/2014 11:37:42 PM, file version: 0, 138, 0, 43576...Done!

New RccService version-6b710957554d494f at 2/19/2014 11:44:54 PM, file version: 0, 138, 0, 43576...Done!

New WindowsPlayer version-7cb30356092f43ac at 2/19/2014 11:47:29 PM, file version: 0, 138, 0, 43576...Done!

New Studio version-d915d946200d4645 at 2/20/2014 6:36:49 PM, file version: 2014, 2, 20, 2...Done!

New RccService version-7c17814b0c244afe at 2/26/2014 11:35:22 PM, file version: 0, 139, 0, 43815...Done!

New WindowsPlayer version-9dddd6d1e4534c53 at 2/26/2014 11:37:01 PM, file version: 0, 139, 0, 43815...Done!

New Studio version-c69341b9e0424537 at 2/27/2014 3:27:20 PM, file version: 0, 134, 1, 43895...Done!

New Studio version-41c762bf5def49cb at 3/5/2014 11:32:11 PM, file version: 0, 140, 0, 44053...Done!

New RccService version-445ab30c01184344 at 3/5/2014 11:42:32 PM, file version: 0, 140, 0, 44053...Done!

New WindowsPlayer version-f77fe2742c314291 at 3/5/2014 11:46:59 PM, file version: 0, 140, 0, 44053...Done!

New Studio version-991930b1d9ce4cf8 at 3/12/2014 11:41:28 PM, file version: 0, 141, 0, 44302...Done!

New RccService version-c9063999c3b742e7 at 3/12/2014 11:51:32 PM, file version: 0, 141, 0, 44302...Done!

New WindowsPlayer version-79a62ec00b324436 at 3/12/2014 11:55:59 PM, file version: 0, 141, 0, 44302...Done!

New Studio version-2c1afdb07d2648a0 at 3/19/2014 11:33:06 PM, file version: 0, 142, 0, 44506...Done!

New RccService version-88408d7e077d409c at 3/19/2014 11:43:12 PM, file version: 0, 142, 0, 44506...Done!

New WindowsPlayer version-a70065f9195a4a76 at 3/19/2014 11:48:11 PM, file version: 0, 142, 0, 44506...Done!

New Studio version-7043db863d444310 at 3/26/2014 11:37:19 PM, file version: 0, 143, 0, 44681...Done!

New RccService version-c971a7d45ae5476d at 3/26/2014 11:47:50 PM, file version: 0, 143, 0, 44681...Done!

New WindowsPlayer version-bd188fd437234e9b at 3/26/2014 11:52:22 PM, file version: 0, 143, 0, 44681...Done!

New Studio version-887681bf8c934aec at 4/2/2014 11:34:57 PM, file version: 0, 144, 0, 45011...Done!

New RccService version-7b0ac89963bf497e at 4/2/2014 11:45:03 PM, file version: 0, 144, 0, 45011...Done!

New WindowsPlayer version-53c562c888894ea7 at 4/2/2014 11:49:35 PM, file version: 0, 144, 0, 45011...Done!

New Studio version-8245c7854b934272 at 4/9/2014 11:31:14 PM, file version: 0, 145, 0, 45304...Done!

New RccService version-07be53aa059548ac at 4/9/2014 11:40:37 PM, file version: 0, 145, 0, 45304...Done!

New WindowsPlayer version-dd7ca4fae8d24153 at 4/9/2014 11:45:03 PM, file version: 0, 145, 0, 45304...Done!

New Studio version-fc2bbcbe00bc46a9 at 4/16/2014 11:36:14 PM, file version: 0, 146, 0, 45440...Done!

New RccService version-ce08ced1b36f4078 at 4/16/2014 11:46:03 PM, file version: 0, 146, 0, 45440...Done!

New WindowsPlayer version-7a590b0ea40f43f0 at 4/16/2014 11:50:35 PM, file version: 0, 146, 0, 45440...Done!

New RccService version-b80488ccb1fc425b at 4/17/2014 12:41:28 AM, file version: 0, 145, 0, 45304...Done!

New WindowsPlayer version-73ae31ae795e410c at 4/17/2014 12:44:21 AM, file version: 0, 145, 0, 45304...Done!

New RccService version-153761b2e7374494 at 4/17/2014 11:33:58 PM, file version: 0, 146, 0, 45615...Done!

New WindowsPlayer version-77cb13cdf4414374 at 4/17/2014 11:36:54 PM, file version: 0, 146, 0, 45615...Done!

New Studio version-75631059d2764d7a at 4/23/2014 11:32:48 PM, file version: 0, 147, 0, 45744...Done!

New RccService version-61d6e75334e340ed at 4/23/2014 11:43:02 PM, file version: 0, 147, 0, 45744...Done!

New WindowsPlayer version-a21a1def88774149 at 4/23/2014 11:47:57 PM, file version: 0, 147, 0, 45744...Done!

New Studio version-1846b3c896114f6c at 4/30/2014 11:32:05 PM, file version: 0, 148, 0, 45925...Done!

New RccService version-2549eef155d84de8 at 4/30/2014 11:42:33 PM, file version: 0, 148, 0, 45925...Done!

New WindowsPlayer version-38d9c3e04e394773 at 4/30/2014 11:47:38 PM, file version: 0, 148, 0, 45925...Done!

New Studio version-f7c73ebe313c4d8b at 5/7/2014 11:33:35 PM, file version: 0, 149, 0, 46203...Done!

New RccService version-151a625caa854205 at 5/7/2014 11:43:31 PM, file version: 0, 149, 0, 46203...Done!

New WindowsPlayer version-187659e292024b9d at 5/7/2014 11:51:33 PM, file version: 0, 149, 0, 46203...Done!

New Studio version-ab9d34a3b2b346b2 at 5/8/2014 10:03:31 PM, file version: 0, 139, 1, 46276...Done!

New Studio version-4bc943abff0a4283 at 5/14/2014 11:38:03 PM, file version: 0, 150, 0, 46522...Done!

New RccService version-619f8df17a464a8f at 5/14/2014 11:48:12 PM, file version: 0, 150, 0, 46522...Done!

New WindowsPlayer version-266c1c454a3c46ab at 5/14/2014 11:52:52 PM, file version: 0, 150, 0, 46522...Done!

New Studio version-90eb0ae9450b454d at 5/15/2014 11:31:44 PM, file version: 0, 150, 1, 46627...Done!

New RccService version-d00016b0e6c94e86 at 5/15/2014 11:41:54 PM, file version: 0, 150, 1, 46627...Done!

New WindowsPlayer version-23a4f309f57a496c at 5/15/2014 11:46:37 PM, file version: 0, 150, 1, 46627...Done!

New Studio version-3049de7b7f1548f0 at 5/21/2014 11:31:06 PM, file version: 0, 151, 0, 46786...Done!

New RccService version-521170bcb1574466 at 5/21/2014 11:41:14 PM, file version: 0, 151, 0, 46786...Done!

New WindowsPlayer version-890fab9e68e74869 at 5/21/2014 11:45:58 PM, file version: 0, 151, 0, 46786...Done!

New Studio version-47d95d96594f4ccb at 5/28/2014 11:32:56 PM, file version: 0, 152, 0, 46962...Done!

New RccService version-05029593f6744f10 at 5/28/2014 11:41:22 PM, file version: 0, 152, 0, 46962...Done!

New WindowsPlayer version-24e66ffe847b42da at 5/28/2014 11:45:30 PM, file version: 0, 152, 0, 46962...Done!

New Studio version-35f04612bfd14403 at 5/29/2014 11:52:34 PM, file version: 0, 152, 1, 47062...Done!

New RccService version-d4a2aae2834244e2 at 5/30/2014 12:00:36 AM, file version: 0, 152, 1, 47062...Done!

New WindowsPlayer version-ca7bb36aabe54be5 at 5/30/2014 12:04:46 AM, file version: 0, 152, 1, 47062...Done!

New Studio version-4b4538e707444292 at 6/4/2014 11:35:04 PM, file version: 0, 153, 0, 47177...Done!

New RccService version-02b7031e776c4833 at 6/4/2014 11:42:27 PM, file version: 0, 153, 0, 47177...Done!

New WindowsPlayer version-4d8b1955ef2740b3 at 6/4/2014 11:46:37 PM, file version: 0, 153, 0, 47177...Done!

New Studio version-29770f19d6954042 at 6/11/2014 11:42:21 PM, file version: 0, 154, 0, 47383...Done!

New RccService version-0e6fb8c34e0f4e1f at 6/11/2014 11:50:07 PM, file version: 0, 154, 0, 47383...Done!

New WindowsPlayer version-459b702c887942d4 at 6/11/2014 11:54:15 PM, file version: 0, 154, 0, 47383...Done!

New Studio version-dbffb174c8c64119 at 6/19/2014 12:01:45 AM, file version: 0, 155, 0, 47629...Done!

New RccService version-796353bd68444455 at 6/19/2014 12:09:12 AM, file version: 0, 155, 0, 47629...Done!

New WindowsPlayer version-2135c02b59614a08 at 6/19/2014 12:13:22 AM, file version: 0, 155, 0, 47629...Done!

New Studio version-886c7b08b73045d7 at 6/25/2014 11:52:45 PM, file version: 0, 156, 0, 48019...Done!

New RccService version-4cb9dd2663b240b5 at 6/26/2014 12:00:50 AM, file version: 0, 156, 0, 48019...Done!

New WindowsPlayer version-3942446d46db45f5 at 6/26/2014 12:05:04 AM, file version: 0, 156, 0, 48019...Done!

New Studio version-81ff3a71693a4c15 at 6/26/2014 11:30:49 PM, file version: 0, 156, 1, 48144...Done!

New RccService version-b4c9a1d72e3f47e7 at 6/26/2014 11:38:25 PM, file version: 0, 156, 1, 48144...Done!

New WindowsPlayer version-3285a67a39c94ff8 at 6/26/2014 11:42:40 PM, file version: 0, 156, 1, 48144...Done!

New Studio version-13fdc33b61c24fb7 at 7/1/2014 11:29:35 PM, file version: 0, 157, 0, 48223...Done!

New RccService version-0e26fabd6b0043e2 at 7/1/2014 11:37:44 PM, file version: 0, 157, 0, 48223...Done!

New WindowsPlayer version-bc583c3455374cb1 at 7/1/2014 11:42:05 PM, file version: 0, 157, 0, 48223...Done!

New RccService version-c72a6e25722f4efd at 7/2/2014 11:33:48 PM, file version: 0, 157, 1, 48302...Done!

New RccService version-179280fe692f4dbd at 7/2/2014 11:40:16 PM, file version: 0, 157, 1, 48302...Done!

New WindowsPlayer version-c04585a2d58a4f29 at 7/2/2014 11:45:09 PM, file version: 0, 157, 1, 48302...Done!

New Studio version-b522f7e2195e41e1 at 7/9/2014 11:35:05 PM, file version: 0, 158, 0, 48436...Done!

New RccService version-39fbef8c8dfc4609 at 7/9/2014 11:43:18 PM, file version: 0, 158, 0, 48436...Done!

New WindowsPlayer version-1112937d32504d8c at 7/9/2014 11:47:46 PM, file version: 0, 158, 0, 48436...Done!

New Studio version-0ef48630f24d41cb at 7/16/2014 11:28:56 PM, file version: 0, 159, 0, 48929...Done!

New RccService version-c854518d2c7c4346 at 7/16/2014 11:37:07 PM, file version: 0, 159, 0, 48929...Done!

New WindowsPlayer version-a2dbb0391e1e433c at 7/16/2014 11:41:26 PM, file version: 0, 159, 0, 48929...Done!

New Studio version-b0ad3ca625774cc9 at 7/17/2014 2:06:06 PM, file version: 0, 159, 1, 48983...Done!

New Studio version-d199d14573544481 at 7/23/2014 11:37:43 PM, file version: 0, 160, 0, 49182...Done!

New RccService version-da0960214fdc4963 at 7/23/2014 11:45:50 PM, file version: 0, 160, 0, 49182...Done!

New WindowsPlayer version-5e847c35ea884813 at 7/23/2014 11:50:18 PM, file version: 0, 160, 0, 49182...Done!

New Studio version-46b9506cf3fc4857 at 7/30/2014 11:34:31 PM, file version: 0, 161, 0, 49421...Done!

New RccService version-8386b4c0198d4ac4 at 7/30/2014 11:42:37 PM, file version: 0, 161, 0, 49421...Done!

New WindowsPlayer version-c4060e4821af4163 at 7/30/2014 11:46:40 PM, file version: 0, 161, 0, 49421...Done!

New Studio version-ffebb25f11204672 at 8/6/2014 11:35:13 PM, file version: 0, 162, 0, 49770...Done!

New RccService version-a4a93ee116ab4c5e at 8/6/2014 11:43:27 PM, file version: 0, 162, 0, 49770...Done!

New WindowsPlayer version-7965aa4926cc425a at 8/6/2014 11:48:04 PM, file version: 0, 162, 0, 49770...Done!

New Studio version-5372a89690d94540 at 8/13/2014 11:32:55 PM, file version: 0, 163, 0, 50106...Done!

New RccService version-97f495442cdc4b9c at 8/13/2014 11:41:15 PM, file version: 0, 163, 0, 50106...Error!

New Studio version-c6a618d7a1404370 at 8/13/2014 11:43:04 PM, file version: 0, 163, 0, 50106...Done!

New RccService version-928b1fa8b1ce498d at 8/13/2014 11:51:23 PM, file version: 0, 163, 0, 50106...Done!

New WindowsPlayer version-45e17934caec46fc at 8/13/2014 11:55:30 PM, file version: 0, 163, 0, 50106...Done!

New WindowsPlayer version-b3ae331dfaef4117 at 8/14/2014 12:02:16 AM, file version: 0, 163, 0, 50106...Done!

New Studio version-56db56d41a444c41 at 8/20/2014 11:35:16 PM, file version: 0, 164, 0, 50577...Done!

New RccService version-5929aff264134316 at 8/20/2014 11:44:39 PM, file version: 0, 164, 0, 50577...Done!

New WindowsPlayer version-9054e3065d02489e at 8/20/2014 11:48:51 PM, file version: 0, 164, 0, 50577...Done!

New Studio version-c0cff7609c78403c at 8/27/2014 11:28:32 PM, file version: 0, 165, 0, 50938...Done!

New RccService version-bbe6d12ad55d42d0 at 8/27/2014 11:37:32 PM, file version: 0, 165, 0, 50938...Done!

New WindowsPlayer version-b4f311f5cfe34914 at 8/27/2014 11:42:04 PM, file version: 0, 165, 0, 50938...Done!

New Studio version-5f5998b41eb5461d at 9/2/2014 11:49:37 PM, file version: 0, 166, 0, 50996...Done!

New RccService version-9f0c906b37854612 at 9/2/2014 11:56:46 PM, file version: 0, 166, 0, 50996...Done!

New WindowsPlayer version-1fc13f51ea764eb7 at 9/2/2014 11:59:52 PM, file version: 0, 166, 0, 50996...Done!

New Studio version-71b6932398ab418d at 9/4/2014 3:13:18 PM, file version: 0, 166, 0, 51150...Done!

New Studio version-aa100569cfba4bfb at 9/10/2014 11:33:50 PM, file version: 0, 167, 0, 51261...Done!

New RccService version-001306257db0432a at 9/10/2014 11:41:05 PM, file version: 0, 167, 0, 51261...Done!

New WindowsPlayer version-ec7c35918e67427c at 9/10/2014 11:44:10 PM, file version: 0, 167, 0, 51261...Done!

New Studio version-cdcf8eb3289a4fc6 at 9/11/2014 11:29:55 PM, file version: 0, 167, 1, 51539...Done!

New RccService version-4ee11d81aa6849e0 at 9/11/2014 11:37:00 PM, file version: 0, 167, 1, 51539...Done!

New WindowsPlayer version-a9f03e66405a4cee at 9/11/2014 11:40:04 PM, file version: 0, 167, 1, 51539...Done!

New WindowsPlayer version-a730860d440c4e6c at 9/17/2014 11:41:19 PM, file version: 0, 168, 0, 51652...Done!

New RccService version-2d752b0f64ea4903 at 9/17/2014 11:46:52 PM, file version: 0, 168, 0, 51652...Done!

New Studio version-bccc2bb702f64213 at 9/17/2014 11:50:54 PM, file version: 0, 168, 0, 51652...Done!

New WindowsPlayer version-2c1f992c1a264ecc at 9/24/2014 11:35:37 PM, file version: 0, 169, 0, 51983...Done!

New RccService version-3194207e86194593 at 9/24/2014 11:41:30 PM, file version: 0, 169, 0, 51983...Done!

New Studio version-8d5b5672245f42ef at 9/24/2014 11:45:36 PM, file version: 0, 169, 0, 51983...Done!

New Studio version-0c30d0c0cd594bac at 9/29/2014 10:07:00 PM, file version: 0, 169, 1, 52122...Done!

New WindowsPlayer version-b44a93d7db0543f5 at 10/1/2014 11:51:33 PM, file version: 0, 170, 0, 52223...Done!

New RccService version-470ae41ad63c4c28 at 10/1/2014 11:57:31 PM, file version: 0, 170, 0, 52223...Done!

New Studio version-cdacbd17c7a14681 at 10/2/2014 12:01:39 AM, file version: 0, 170, 0, 52223...Done!

New WindowsPlayer version-b155910bba974e13 at 10/2/2014 11:36:01 PM, file version: 0, 170, 0, 52322...Done!

New RccService version-371674c363944db4 at 10/2/2014 11:41:18 PM, file version: 0, 170, 0, 52322...Done!

New Studio version-158847adc702448f at 10/2/2014 11:45:14 PM, file version: 0, 170, 0, 52322...Done!

New Studio version-804d5bfeb4594529 at 10/8/2014 11:33:59 PM, file version: 0, 171, 0, 52407...Done!

New RccService version-a59ded919a704a11 at 10/8/2014 11:41:32 PM, file version: 0, 171, 0, 52407...Done!

New WindowsPlayer version-e66ffbb509ce4483 at 10/8/2014 11:44:28 PM, file version: 0, 171, 0, 52407...Done!

New WindowsPlayer version-3c9713a635454fdb at 10/15/2014 11:41:05 PM, file version: 0, 172, 0, 52734...Done!

New RccService version-65d21ebc23a54f06 at 10/15/2014 11:46:31 PM, file version: 0, 172, 0, 52734...Done!

New Studio version-e1c4efc00b0640c6 at 10/15/2014 11:50:36 PM, file version: 0, 172, 0, 52734...Done!

New RccService version-8b1fc6b3fdbe4d4a at 10/16/2014 11:31:07 PM, file version: 0, 172, 1, 52886...Done!

New RccService version-bddeeaa4a1ad4266 at 10/16/2014 11:50:19 PM, file version: 0, 172, 1, 52886...Done!

New WindowsPlayer version-c2a7e6748ad54a86 at 10/16/2014 11:52:17 PM, file version: 0, 172, 1, 52886...Done!

New Studio version-f6bfa7285fd0495d at 10/16/2014 11:58:13 PM, file version: 0, 172, 1, 52886...Done!

New WindowsPlayer version-e3f54ee812af4a09 at 10/22/2014 11:35:59 PM, file version: 0, 173, 0, 52968...Done!

New RccService version-4c3f4aebef2a47ad at 10/22/2014 11:41:34 PM, file version: 0, 173, 0, 52968...Done!

New Studio version-05f3ca684de54165 at 10/22/2014 11:45:40 PM, file version: 0, 173, 0, 52968...Done!

New RccService version-5f0729559d7b4e38 at 10/23/2014 11:50:59 PM, file version: 0, 173, 1, 53125...Done!

New WindowsPlayer version-d65566343374484f at 10/23/2014 11:52:56 PM, file version: 0, 173, 1, 53125...Done!

New Studio version-25f867ffe1ae4791 at 10/23/2014 11:59:19 PM, file version: 0, 173, 1, 53125...Done!

New Studio version-7e274d57a03240c9 at 10/27/2014 11:30:17 PM, file version: 0, 173, 0, 53242...Done!

New RccService version-81cc70e6ae324af4 at 10/29/2014 11:31:07 PM, file version: 0, 174, 0, 53305...Done!

New WindowsPlayer version-3d3973aa91b04fab at 10/29/2014 11:33:05 PM, file version: 0, 174, 0, 53305...Done!

New Studio version-b56b78b6a52f48cc at 10/29/2014 11:39:49 PM, file version: 0, 174, 0, 53305...Done!

New WindowsPlayer version-68c511c8ee3948f6 at 10/30/2014 11:34:16 PM, file version: 0, 174, 0, 53367...Done!

New RccService version-cceda9a5de6d4627 at 10/30/2014 11:39:56 PM, file version: 0, 174, 0, 53367...Done!

New Studio version-432eb623016147d0 at 10/30/2014 11:44:00 PM, file version: 0, 174, 0, 53367...Done!

New Studio version-a0a203b684b340d1 at 11/3/2014 7:55:10 PM, file version: 0, 174, 0, 53472...Done!

New RccService version-001d320a6a0f4e06 at 11/6/2014 12:31:59 AM, file version: 0, 175, 0, 53496...Done!

New WindowsPlayer version-3c8dc04e91444aba at 11/6/2014 12:34:08 AM, file version: 0, 175, 0, 53496...Done!

New Studio version-80a422631d6b4dba at 11/6/2014 12:40:44 AM, file version: 0, 175, 0, 53496...Done!

New Studio version-feb0eadf2415423d at 11/6/2014 10:02:27 PM, file version: 0, 175, 0, 53623...Done!

New RccService version-2e13fb83c7d442cd at 11/12/2014 11:31:08 PM, file version: 0, 176, 0, 53771...Done!

New WindowsPlayer version-3248bf75d66c4154 at 11/12/2014 11:33:07 PM, file version: 0, 176, 0, 53771...Done!

New Studio version-93179d6a9dfc4075 at 11/12/2014 11:40:36 PM, file version: 0, 176, 0, 53719...Done!

New Studio version-9bfbbf0b67514492 at 11/17/2014 5:39:36 PM, file version: 0, 176, 0, 53968...Done!

New Studio version-1250d4cb868f4581 at 11/18/2014 11:32:20 PM, file version: 0, 176, 0, 53968...Done!

New WindowsPlayer version-3f5235ea29d74b24 at 11/19/2014 11:37:16 PM, file version: 0, 177, 0, 53981...Done!

New RccService version-125d7849daf94afe at 11/19/2014 11:43:22 PM, file version: 0, 177, 0, 53981...Done!

New Studio version-5b0cda818c26494a at 11/19/2014 11:47:31 PM, file version: 0, 177, 0, 53981...Done!
Error!

New Studio version-78fa3296beed4164 at 11/19/2014 11:58:11 PM, file version: 0, 177, 0, 53981...Done!

New RccService version-349b4ffd867247f7 at 11/20/2014 12:53:40 AM, file version: 0, 176, 0, 53771...Done!

New WindowsPlayer version-0aae98b55b324621 at 11/20/2014 12:55:44 AM, file version: 0, 176, 0, 53771...Done!

New Studio version-93993f8250d14552 at 11/20/2014 8:32:59 PM, file version: 0, 177, 0, 54090...Done!

New Studio version-882be8be9bd64eb4 at 11/24/2014 7:16:08 PM, file version: 0, 177, 0, 54156...Done!

New RccService version-6f39dec56f244839 at 12/3/2014 11:29:56 PM, file version: 0, 177, 0, 54327...Done!

New WindowsPlayer version-632471a80776450d at 12/3/2014 11:32:22 PM, file version: 0, 177, 0, 54327...Done!

New Studio version-690117d1a88742de at 12/3/2014 11:40:19 PM, file version: 0, 177, 0, 54327...Done!

New RccService version-c79f88afaccc44bb at 12/10/2014 11:33:45 PM, file version: 0, 178, 0, 54547...Done!

New WindowsPlayer version-d11d3bd1dfae46fa at 12/10/2014 11:35:56 PM, file version: 0, 178, 0, 54547...Done!

New Studio version-35d6b13039a64ce1 at 12/10/2014 11:48:58 PM, file version: 0, 178, 0, 54547...Done!

New RccService version-9cfc8dc7ec384286 at 1/7/2015 11:30:37 PM, file version: 0, 179, 0, 54695...Done!

New WindowsPlayer version-d2af929835a34f18 at 1/7/2015 11:32:43 PM, file version: 0, 179, 0, 54695...Done!

New Studio version-946779d1f8ce4616 at 1/7/2015 11:43:08 PM, file version: 0, 179, 0, 54695...Done!

New Studio version-58745f8fd5034a57 at 1/12/2015 7:54:45 PM, file version: 0, 177, 0, 55147...Done!

New WindowsPlayer version-1b62582f111742b3 at 1/14/2015 11:34:47 PM, file version: 0, 180, 0, 55224...Done!

New RccService version-48d35abab305455d at 1/14/2015 11:41:01 PM, file version: 0, 180, 0, 55224...Done!

New Studio version-b6927f6f937b437b at 1/14/2015 11:45:18 PM, file version: 0, 180, 0, 55224...Done!

New WindowsPlayer version-4764aa5f75b7446c at 1/21/2015 11:33:57 PM, file version: 0, 181, 0, 55371...Done!

New RccService version-e85293ed456d46a1 at 1/21/2015 11:45:57 PM, file version: 0, 181, 0, 55371...Done!

New Studio version-e8ce742bc2074191 at 1/21/2015 11:50:29 PM, file version: 0, 181, 0, 55371...Done!

New WindowsPlayer version-5d9b22aa9d594ee1 at 1/29/2015 1:29:25 AM, file version: 0, 182, 0, 55759...Done!

New RccService version-7b35cb1a181c4c75 at 1/29/2015 1:35:49 AM, file version: 0, 182, 0, 55759...Done!

New Studio version-595cba8462934a4b at 1/29/2015 1:40:05 AM, file version: 0, 182, 0, 55759...Done!

New WindowsPlayer version-7bf02ef54e3249d6 at 2/4/2015 11:34:43 PM, file version: 0, 183, 0, 55974...Done!

New RccService version-fc29d8a1c8c14198 at 2/4/2015 11:40:58 PM, file version: 0, 183, 0, 55974...Done!

New Studio version-f811990683b94129 at 2/4/2015 11:45:23 PM, file version: 0, 183, 0, 55974...Done!

New WindowsPlayer version-f4fa73127aa54242 at 2/11/2015 11:42:37 PM, file version: 0, 184, 0, 56182...Done!

New RccService version-79c95f3c66a2461c at 2/11/2015 11:49:46 PM, file version: 0, 184, 0, 56182...Done!

New Studio version-1f38497c479f46cb at 2/11/2015 11:53:53 PM, file version: 0, 184, 0, 56182...Done!

New WindowsPlayer version-708f91f0ad924d5c at 2/19/2015 11:36:15 PM, file version: 0, 185, 0, 56461...Done!

New RccService version-9a2eda00c8b441b1 at 2/19/2015 11:43:05 PM, file version: 0, 185, 0, 56461...Done!

New Studio version-03db65ea2b474052 at 2/19/2015 11:47:45 PM, file version: 0, 185, 0, 56461...Done!

New Studio version-829e90842df44a35 at 2/20/2015 5:01:22 PM, file version: 0, 184, 0, 56182...Done!

New WindowsPlayer version-c0830f3a542d41e9 at 2/25/2015 11:37:58 PM, file version: 0, 186, 0, 56666...Done!

New RccService version-922473adf4e84dd9 at 2/25/2015 11:44:42 PM, file version: 0, 186, 0, 56666...Done!

New Studio version-3c5f4716682347aa at 2/25/2015 11:49:02 PM, file version: 0, 186, 0, 56666...Done!

New WindowsPlayer version-60f68cddda9b4f9b at 3/4/2015 11:22:09 PM, file version: 0, 187, 0, 56990...Done!

New RccService version-fd8d21272c8a41f8 at 3/4/2015 11:28:46 PM, file version: 0, 187, 0, 56990...Done!

New Studio version-7dcc492b6cc94f8f at 3/4/2015 11:33:07 PM, file version: 0, 187, 0, 56990...Done!

New WindowsPlayer version-a59a59ef5163481d at 3/5/2015 11:48:00 PM, file version: 0, 187, 1, 57093...Done!

New RccService version-bf1f1165ad07408d at 3/5/2015 11:55:05 PM, file version: 0, 187, 1, 57093...Done!

New WindowsPlayer version-3c333d16b2ee4af9 at 3/11/2015 11:31:45 PM, file version: 0, 188, 0, 57264...Done!

New RccService version-de85d6cb9fc0464e at 3/11/2015 11:38:46 PM, file version: 0, 188, 0, 57264...Done!

New Studio version-cdd7de828bd74551 at 3/11/2015 11:43:08 PM, file version: 0, 188, 0, 57264...Done!

New WindowsPlayer version-ee132c69c07b49ac at 3/18/2015 11:28:02 PM, file version: 0, 189, 0, 57555...Done!

New RccService version-d0c7f7d8579b465d at 3/18/2015 11:34:42 PM, file version: 0, 189, 0, 57555...Done!

New Studio version-15753d16f7704e03 at 3/18/2015 11:38:55 PM, file version: 0, 189, 0, 57555...Done!

New WindowsPlayer version-85dea912193840ca at 3/19/2015 12:19:25 PM, file version: 0, 188, 0, 57264...Done!

New RccService version-55ff59944ddd4320 at 3/19/2015 12:26:13 PM, file version: 0, 188, 0, 57264...Done!

New Studio version-68004cbef0e044a5 at 3/19/2015 12:30:46 PM, file version: 0, 188, 0, 57264...Done!

New WindowsPlayer version-3a1b3a29e18e4ba7 at 3/19/2015 11:36:24 PM, file version: 0, 189, 0, 57585...Done!

New RccService version-0ba1ea0d4d2745e4 at 3/19/2015 11:43:41 PM, file version: 0, 189, 0, 57585...Done!

New Studio version-0138bdb93b5f43f5 at 3/19/2015 11:52:07 PM, file version: 0, 189, 0, 57585...Done!

New WindowsPlayer version-f9d6d23b9b1b466e at 3/25/2015 11:36:33 PM, file version: 0, 190, 0, 57794...Done!

New RccService version-397a77f6658e4c4c at 3/25/2015 11:43:30 PM, file version: 0, 190, 0, 57794...Done!

New Studio version-bcb99606f1234e3d at 3/25/2015 11:47:47 PM, file version: 0, 190, 0, 57794...Done!

New WindowsPlayer version-324a342b10a34d44 at 4/1/2015 11:29:39 PM, file version: 0, 191, 0, 57924...Done!

New RccService version-a2722c2eaffa4eb7 at 4/1/2015 11:37:14 PM, file version: 0, 191, 0, 57924...Done!

New Studio version-f653b028cede4145 at 4/1/2015 11:41:39 PM, file version: 0, 191, 0, 57924...Done!

New Studio version-f7efc059bf134e8d at 4/2/2015 12:20:14 PM, file version: 0, 190, 0, 57794...Done!

New WindowsPlayer version-953d9034d866480b at 4/2/2015 11:29:42 PM, file version: 0, 191, 1, 58048...Done!

New RccService version-ee24be7345c148f8 at 4/2/2015 11:37:12 PM, file version: 0, 191, 1, 58048...Done!

New Studio version-c743e123c2404843 at 4/2/2015 11:42:00 PM, file version: 0, 191, 1, 58048...Done!

New WindowsPlayer version-b2724f2b92df45bf at 4/8/2015 11:40:57 PM, file version: 0, 192, 0, 58109...Done!

New WindowsPlayer version-d0c46c562fb34e08 at 4/8/2015 11:58:54 PM, file version: 0, 192, 0, 58109...Done!

New RccService version-003f403d9eb14fc1 at 4/9/2015 12:08:32 AM, file version: 0, 192, 0, 58109...Done!

New Studio version-789cf7f9d1314ee3 at 4/9/2015 12:17:30 AM, file version: 0, 192, 0, 58109...Done!

New Studio version-79b0247598a34680 at 4/9/2015 12:47:30 AM, file version: 0, 192, 0, 58109...Done!

New WindowsPlayer version-2ee5d7d0d55c4aa7 at 4/15/2015 11:37:04 PM, file version: 0, 193, 0, 58295...Done!

New RccService version-ed2941282b7d4904 at 4/15/2015 11:44:49 PM, file version: 0, 193, 0, 58295...Done!

New Studio version-67e263a87847420c at 4/15/2015 11:49:11 PM, file version: 0, 193, 0, 58295...Done!

New Studio version-3b42dd2b6f7045a3 at 4/16/2015 12:03:41 AM, file version: 0, 193, 0, 58295...Done!

New WindowsPlayer version-3d4e94308bba44a5 at 4/16/2015 12:24:37 AM, file version: 0, 193, 0, 58295...Done!

New RccService version-c5ec4620636f4702 at 4/16/2015 12:32:01 AM, file version: 0, 193, 0, 58295...Done!

New WindowsPlayer version-1cfeb951d6084e36 at 4/16/2015 2:46:01 AM, file version: 0, 192, 0, 58109...Done!

New RccService version-bd1a41d87eb94bf7 at 4/16/2015 2:53:37 AM, file version: 0, 192, 0, 58109...Done!

New Studio version-af96ba91ce124068 at 4/16/2015 2:57:50 AM, file version: 0, 192, 0, 58109...Done!

New WindowsPlayer version-d406f4a063944ff7 at 4/22/2015 11:52:37 PM, file version: 0, 193, 0, 58719...Done!

New RccService version-1e36ebc6d9444a8e at 4/23/2015 12:00:19 AM, file version: 0, 193, 0, 58719...Done!

New Studio version-938f4b80ed7144b1 at 4/23/2015 12:05:02 AM, file version: 0, 193, 0, 58719...Done!

New WindowsPlayer version-465ca0bcd6b344c3 at 4/24/2015 12:19:23 AM, file version: 0, 193, 0, 58819...Done!

New Studio version-9139d09fb1c74249 at 4/24/2015 12:37:45 AM, file version: 0, 193, 0, 58819...Done!

New WindowsPlayer version-4b9dbcf548b340e2 at 4/29/2015 11:33:44 PM, file version: 0, 194, 0, 59009...Done!

New WindowsPlayer version-957ce0cc47814d39 at 4/29/2015 11:46:04 PM, file version: 0, 194, 0, 59009...Done!

New RccService version-27d50f436dbc4d06 at 4/29/2015 11:53:40 PM, file version: 0, 194, 0, 59009...Done!

New RccService version-250471d8efed43ed at 4/30/2015 12:01:00 AM, file version: 0, 194, 0, 59009...Done!

New Studio version-2e2bc724a5894667 at 4/30/2015 3:51:29 PM, file version: 0, 194, 0, 59050...Done!

New WindowsPlayer version-d2fd1d56447746e9 at 5/6/2015 11:38:00 PM, file version: 0, 195, 0, 59286...Done!

New RccService version-6efc9a999b95455c at 5/6/2015 11:45:58 PM, file version: 0, 195, 0, 59286...Done!

New Studio version-9134d247a1624346 at 5/6/2015 11:50:34 PM, file version: 0, 195, 0, 59286...Done!

New RccService version-68a21e4d30ba4947 at 5/20/2015 11:45:16 PM, file version: 0, 196, 0, 59751...Done!

New Studio version-615500bf52054337 at 5/20/2015 11:49:54 PM, file version: 0, 196, 0, 59751...Done!

New WindowsPlayer version-482ae366f82d4d7c at 5/21/2015 12:09:11 AM, file version: 0, 196, 0, 59751...Done!

New RccService version-0261794fa2d04758 at 5/21/2015 12:17:09 AM, file version: 0, 196, 0, 59751...Done!

New WindowsPlayer version-dd5b203ef99a4823 at 5/27/2015 11:30:39 PM, file version: 0, 197, 0, 59946...Done!

New RccService version-1e633ff2b1ca4a04 at 5/27/2015 11:38:34 PM, file version: 0, 197, 0, 59946...Done!

New Studio version-7b5c4ce60310443e at 5/27/2015 11:43:32 PM, file version: 0, 197, 0, 59946...Done!

New WindowsPlayer version-7c0f71fde5c44113 at 5/28/2015 11:35:30 PM, file version: 0, 197, 1, 60072...Done!

New RccService version-614c7d1b32d34160 at 5/28/2015 11:43:38 PM, file version: 0, 197, 1, 60072...Done!

New Studio version-d5b61445694d418a at 5/28/2015 11:48:16 PM, file version: 0, 197, 1, 60072...Done!

New WindowsPlayer version-e7d5859bbf11477d at 6/3/2015 11:33:27 PM, file version: 0, 198, 0, 60235...Done!

New RccService version-c9a615991eca40bf at 6/3/2015 11:40:54 PM, file version: 0, 198, 0, 60235...Done!

New Studio version-f52b3c58002743ad at 6/3/2015 11:45:26 PM, file version: 0, 198, 0, 60235...Error!

New Studio version-cdfccceb662247e9 at 6/3/2015 11:54:21 PM, file version: 0, 198, 0, 60235...Done!

New WindowsPlayer version-82e6de6907934ba0 at 6/10/2015 11:30:09 PM, file version: 0, 199, 0, 60447...Done!

New RccService version-410eb3b908f145fe at 6/10/2015 11:37:53 PM, file version: 0, 199, 0, 60447...Done!

New Studio version-cbd9b90bb0dc41d4 at 6/10/2015 11:43:02 PM, file version: 0, 199, 0, 60447...Done!

New WindowsPlayer version-a96b3e2526084b6d at 6/11/2015 12:03:58 AM, file version: 0, 199, 0, 60447...Done!

New RccService version-cf46b08a6fdb4650 at 6/11/2015 12:11:32 AM, file version: 0, 199, 0, 60447...Done!

New Studio version-0b8fe16f3d5f488f at 6/11/2015 12:16:21 AM, file version: 0, 199, 0, 60447...Done!

New WindowsPlayer version-8c5c6ce7499b4544 at 6/11/2015 2:56:53 AM, file version: 0, 199, 0, 60486...Done!

New RccService version-c2e41891e87045ed at 6/11/2015 3:04:40 AM, file version: 0, 199, 0, 60486...Done!

New Studio version-1808a1f8da7e4dc0 at 6/11/2015 6:26:41 PM, file version: 0, 177, 0, 60482...Done!

New Studio version-96eb7d40254844a4 at 6/11/2015 10:15:19 PM, file version: 0, 199, 0, 60526...Done!

New WindowsPlayer version-ea077ae9bef64263 at 6/17/2015 11:30:47 PM, file version: 0, 200, 0, 60693...Done!

New RccService version-3f3f43afd3ee4860 at 6/17/2015 11:38:57 PM, file version: 0, 200, 0, 60693...Done!

New Studio version-15308e5174104cec at 6/17/2015 11:44:00 PM, file version: 0, 200, 0, 60693...Done!

New WindowsPlayer version-9d174e484c8b493e at 6/24/2015 11:42:39 PM, file version: 0, 201, 0, 60893...Done!

